text,summary
"Një nga ndërtesat më të larta të Nju Jorkut, Empire State Building i qendroi vendimit për të mos ndezur dritat bardhë e blu në me rastin e 100 vjetorit të lindjes së Nënë Terezës. Mbrëmë, ngjyrat e saj ishin e bardha, bluja dhe e kuqja, që simbolizonin një përvjetor tjetër, 90-vjetorin e amendamentit të 19 të kushtetutës amerikane i cili i dha grave të drejtën e votës. Qindra njerez u mblodhen mbreme ne proteste për t'u deklaruar pronarëve të ndërtesës se Empire State duhet të kishte nderuar para së gjithash Nënë Terezën. Nga viti 1931 e deri më 1972, për 40 vjet me radhë, Empire State ka qenë ndërtesa më e lartë e botës. Sot ajo është një simbol i fuqisë dhe i historisë së Nju Jorkut. Por qindra njerëzit që u grumbulluan aty dje pasdite besojnë se pronarët e ndërtesës hodhën një hap të gabuar duke refuzuar të nderojnë Nënë Terezën në 100 vjetorin e saj të lindjes. Protesta u organizua nga Lidhja Katolike por për shumicën e protestuesve feja nuk duket të ishte një temë me rëndësi. Shqiptarët iu bashkuan thirrjes së Ligës Katolike për të protestuar. Xho DioGuardi, i Lidhjes Civile Shqiptaro-Amerikane tha se dëshironte t'u kujtonte edhe një herë njerëzve se kush ishte Nënë Tereza. ""Ajo është një idhull për botën, për katolikët ajo është qysh tani një shenjtore. Por ajo është një shenjtore patriote për të gjithë shqiptarët, pavarësisht nëse janë katolikë, myslimanë, ortodoksë apo edhe hebrej. Kam ardhur gjithashtu për t'u thënë pronarëve të kësaj ndërtese se ata bënë një gabim të madh duke mos e nderuar atë me ngjyrat e saj në 100 vjetorin e lindjes"". Gjatë gjithë kësaj jave, cështja e ngjyrave që do të zgjidhte ndërtesa Empire State ka qenë në qendër të debateve këtu në Nju Jork, ndërkohë që disa pohojnë se nëse do të ishte gjallë Nënë Tereza nuk dë të kishte qenë dakord që për ditëlindjen e saj të bëhej kaq bujë. Mbrëmë, në një pjesë tjetër të Manhatanit, në katedralen e Shën Patrikut, shqiptarët e përkujtuan 100 vjetorin e Nënë Terezës me një meshë të madhe. Zgjedhja e kishës më të bukur të Nju Jorkut për këtë ngjarje i dha një solemnitet të pazakontë ceremonive. Mesha u dha nga Dom Pjetër Popaj, i cili drejton kishën Zoja e Shkodrës në Hartsdale të Nju Jorkut. Kleriku i bëri një përshkrim origjinës dhe jetës së Nënë Terezës, duke theksuar fjalët e saj: Me gjak jam shqiptare, me qytetari jam indiane ndërsa si besim jam murgeshë katolike. Në meshë kishin ardhur edhe njerëz të besimeve të tjera. “Ne kështu kem i qenë gjithmonë, kemi qenë një gjithmonë. Ne i respektojmë diferencat por e dashurojmë bashkimin me njëri-tjetrin,” tha Dom Pjetër Popaj për Zërin e Amerikës. Ai theksoi se shqiptarët janë sot një popull më i njohur në botë në sajë të lidhjes së gjakut që kanë me bamirësen e famshme.",Meshë e madhe e shqiptarëve në Manhatan për të nderuar bamirësen me famë botërore
"Në Tiranë u firmos sot kontrata e pranimit për pajisjen e Forcës Ajrore shqiptare me helikopterë “Black Hawk”, pjesë e një programi të bashkëfinancuar nga qeveria shqiptare dhe ajo amerikane. Kontrata u nënshkrua në bazën ajrore shqiptare në Farkë, nga ministrja e Mbrojtjes Olta Xhaçka dhe ambasadorja amerikane Yuri Kim. Për zonjën Xhaçka “”. Ndërsa ambasadorja Kim “”. Pajisja me helikopterët Blackhawk u diskutua gjatë vizitës në Shtetet e Bashkuara një vit më parë, të ministres Xhaçka. Gjatë kësaj kohe pilotët shqiptarë janë trajnuar pranë Gardës Kombëtare të Neë Jersey. Brenda viti, pritet që fillimisht të mbërrijnë në Shqipëri dy helikopterë. Helikopterët UH-60 Blackhawk, kanë një rreze të gjera përdorimi. Ambasadorja Kim shpjegoi se ato “”. Ajo shtoi më tutje se së bashku me helikopterët “”.", Brenda fundit të viti pritet të mbërrijnë dy “UH-60 Blackhaëk”. Ambasadorja amerikane: SHBA dhe Shqipëria qëndrojnë “krah për krah” sot e do të qëndrojmë “krah për krah” nesër 
"Gjyqtarët në SHBA hodhën poshtë të hënën paditë e ngritura nga një aleate e Presidentit Donald Trump për të anuluar çertifikimin e fitores së Presidentit të zgjedhur Joe Biden në shtetet Miçigan dhe Xhorxhia dhe për të shpallur zotin Trump fitues në të dy shtetet. Të dy proceset gjyqësore u paraqitën më 25 nëntor nga Sidney Powell, ish-avokate e fushatës së Presidentit Trump, në emër të grupeve të votuesve republikanë. Presidenti Trump dhe aleatët e tij kanë humbur padi të shumta gjyqësore që synonin përmbysjen e rezultateve të zgjedhjeve të 3 nëntorit në shtetet ku ai humbi, duke ngritur pretendime të pabazuara për mashtrim. Gjyqtarja e Qarkut Linda Parker në Detroit dhe gjyqtari i Qarkut Timothy Batten në Atlanta thanë se paditësit nuk kishin bazë ligjore për të ngritur padi dhe se çështjet ishin ngritur me shumë vonesë. ""Populli foli,"" shkroi gjyqtarja Parker, duke iu referuar rezultateve të zgjedhjeve. Ndërsa gjyqtari Batten tha një seancë të hënën se paditësit po kërkonin ""ndoshta vendimin më të jashtëzakonshëm të kërkuar ndonjëherë"" në lidhje me një zgjedhje. ""Ata duan që kjo gjykatë të zëvendësojë gjykimin e saj me atë të dy milionë e gjysmë votuesve të Xhorxhias që votuan për Joe Bidenin dhe unë nuk kam ndërmend ta bëj,” tha ai. Zoti Biden e fitoi Miçiganin me rreth 154,000 vota popullore më shumë dhe Xhorxhian me rreth 12,000 vota më shumë, duke siguruar 16 vota elektorale nga secili shtet. Zoti Biden grumbulloi gjithsej 306 vota elektorale ndaj 232 të marra nga Presidenti Trump në Kolegjin Zgjedhor, i cili përcakton fituesin e zgjedhjeve presidenciale. Kolegji Zgjedhor mblidhet në 14 Dhjetor për të hedhur zyrtarisht votat. Presidenti Trump, i cili pretendon në mënyrë të pabazuar se i fitoi zgjedhjet ka ndërmarrë një betejë të pasuksesshme ligjore për të zhbërë rezultatet e zgjedhjeve. Gjyqtarët gjithashtu kanë hedhur poshtë çështjet gjyqësore në Arizona, Pensilvani, Nevada dhe Uiskonsin. ""Ky proces gjyqësor duket se ka të bëjë më pak me ndihmën që kërkojnë paditësit - pasi kjo ndihmë është përtej fuqisë së kësaj gjykate - dhe më tepër me një përpjekje që pretendimet e tyre të ndikojnë tek besimi i njerëzve ndaj procesit demokratik, tek besimi i tyre ndaj qeverisë sonë,"" shtoi gjyqtari. Demokratët dhe të tjerë e kanë akuzuar Presidentin Trump se po përpiqet të dëmtojë besimin e publikut tek integriteti i zgjedhjeve amerikane dhe të minojë demokracinë. Një shumicë republikanësh në sondazhet e fundit kanë thënë se ata besojnë që zoti Trump i fitoi zgjedhjet dhe se ato u vodhën përmes mashtrimit të votuesve. Zyrtarët shtetërorë të zgjedhjeve kanë thënë se nuk ka prova për një mashtrim të tillë. E marta është afati që shtetet të zgjidhin mosmarrëveshjet për zgjedhjet. Sipas ligjit amerikan, Kongresi e quan rezultatin e zgjedhjeve në një shtet ""përfundimtar"" nëse ai finalizohet deri në atë datë.","Paditë e paraqitura nga Sidney Powell, ish-avokate e fushatës së Presidentit Trump, synon të përmbysnin çertifikimin e zgjedhjeve në këto dy shtete."
"Avionët luftarakë izraelitë bombarduan sot një numër objektivash në Liban, për të nëntën ditë me radhë, ndërkohë që janë zhvilluar luftime edhe më të ashpëra mes forcave tokësore izraelite dhe atyre të grupit Hezbollah, në jug të Libanit. Ushtarët izraelitë hynë përsëri sot me forcë në Liban dhe Hezbollahu hodhi raketa të tjera në Izrael. Zyrtarët izraelitë thonë se 11 ushtarë dhe një numër i panjohur luftëtarësh të grupit Hezbollah u plagosën në luftime. Stacioni televiziv arab Al Xhazira, njofton se tre ushtarë izraelitë u vranë. Ushtria izraelite nuk e ka konfirmuar këtë numër. Ministri izraelit i Mbrojtjes, Amir Perez, tha se vendi i tij do të përdorë të gjitha mjetet për të dëbuar grupin Hezbollah nga jugu i Libanit. Izraeli thotë se banorët në jug të lumit Litnai, 30 kilometra në brendësi të territorit libanez duhet të largohen nga ajo zonë. Kryeministri libanez, Fuad Siniora thotë se 300 libanezë, shumica e tyre civilë, janë vrarë këto ditë. Izraeli thotë se ka humbur 30 njerëz që nga koha e shpërthimit të luftimeve, më 12 korrik, kur Hezbollahu kapi dy ushtarë izraelitë. Sekretari i Përgjithshëm i Kombeve të Bashkuara Kofi Annan bëri thirrje për ndalimin e menjëhershëm të luftimeve midis Izraelit dhe grupit Hezbolla, për të lejuar diplomacinë të gjejë një zgjidhje për krizën. Duke folur para Këshillit të Sigurimit të OKB-së, zoti Annan tha se Izraeli ka përdorur forcë të tepruar në Liban, por shtoi se Hezbollahu e provokoi Izraelin dhe se ky grup duhet të lirojë dy ushtarët e kapur. Zoti Annan, bëri gjithashtu thirrje për dërgimin e një force paqeruajtëse në Libanin jugor dhe për organizimin e një konferencë ndërkombëtare, për të përcaktuar kufirin kohor kur Libani të marrë nën kontroll gjithë territorin e tij. Ambasadori izraelit në OKB tha se zoti Annan nuk shqyrtoi shkaqet e krizës, që siç tha ai, janë terrori si dhe përkrahësit e Hezbollahut, Irnai dhe Siria. Departamenti i Shtetit njoftoi sot se Sekretarja e Shtetit Kondoliza Rajs do të shkojë në Lindjen e Mesme që javën tjetër, në përpjekje për të qetësuar situatën.//lk",Sekretari i Përgjithshëm i OKB-së bën thirrje për ndalimin e menjëhershëm të luftimeve dhe gjetjen e një zgjidhjeje diplomatike   
"Më 22 maj Partia Demokratike do të zhvillojë garën për kreun e ri të saj. Një garë e cila duket se do të jetë tërësisht formale, duke qenë se drejtimin e saj e synon ish kryeministri Sali Berisha, i cili praktikisht dhe e ushtron këtë funksion. Ai u trajtua thuajse si i tillë dhe në sallën e Kuvendit. Muzika dhe ovacionet e shoqëruan atë drejt podiumit ku do të merrte fjalën, aq sa për shkak të entuziazmit, i përqëndruar të përshëndeste delegatët e ngritur në këmbë për të, zoti Berisha u pengua dhe në shkallët e skenës. Fjala e tij ishte një platformë politike e partisë, të cilën ai pritet ta drejtojë dhe zyrtarisht pas zgjedhjeve të 22 majit. Ai preku një shumëllojshmëri temash e problematikash, shoqëruar me zgjidhjet që siç tha, do të ofrojë Partia Demokratike, që nga ulja e taksave, të rishikimi i reformës në Drejtësi “për të zhdukur pasojat katastrofale të një reforme të korruptuar, apo te premtimi për nënshtetësi dhe për qytetarët e Kosovës. Zoti Berisha u shpreh se rruga e rithemelimit ishte një rrugë e imponuar nga disfatat e njëpasnjëshme të ish kryetarit Lulzim Basha “i cili e konsideroi këtë parti si sipërmarrjen e tij private, që vlerat konservatore i zëvendësoi në pazaret dhe bizneset me qeverinë, i cili së fundmi përfundoi i mbërthyer nga të gjitha anët dhe u vërsul me tërbim me vendime, me praktika, me qëndrime fund e krye antidemokratike. Shkelmoi sovranitetin e PD-së, statutin, forumet, anëtarësinë e saj”. Por më shumë se sa humbjet elektorale të zotit Basha, rikthimi në skenë i zotit Berisha u nxit nga vendimi që e la atë jashtë grupit parlamentar, pasi më herët Departamenti amerikan i Shtetit e shpalli ish kryeministrin Berisha “non grata për korrupsion madhor”. Ai sërish sot tha se ky kishte qenë një vendim i marrë pa prova e fakte. “Unë jam Sali Berisha. Kurrë, kurrë, kurrë, shpifjet, gënjeshtrën nuk e pranoj për të vërtetë. Jam mirënjohës pa kufi, ndaj jush që ndani me mua këtë qëndrim”, deklaroi ai. Më pas, gjatë fjalës së tij të gjatë, nënvizoi se “jemi forcë sovrane konservatore, e cila qëndron në të drejtën e idealeve konservatore të shqiptarëve, të cilët, edhe një herë theksoj, as e majta e Xhorxh Sorosit dhe as e majta botërore nuk do mund ta kurrë ta mposhtin. Jo dhe jo”. Në podium e Kuvendit të sotëm u ngjitën dhe figura të njohura të Partisë të lënë mënjanë nga zoti Basha. Salla priti duartrokitje ish nënkryetaren Jozefina Topalli, një kundërshtare e hershme e zotit Basha. Por i vetmi zë kritik, që nuk ju bashkua entuziazmit të një ndryshimi të pritshëm për Partinë Demokartike ishte ai Fatbardh Kadillit, i cili ju kundërvu zoti Basha menjëherë pas zgedhjeve të 25 prillit të vitit të kaluar, por që nuk i ka kursyer kritikat edhe ndaj ish kryeministrit. “Zoti Berisha kërkon me këmbëngulje të bëhet kryetar partie dhe kandidat për kryeministër. Kërkon të mbetet oferta e vetme e PD, kur jemi në dekadën e tretë të shekullit XXI. Ndërkohë, është e sigurtë se e gjithë elita e re drejtuse e PD-së, që do të dalë nga ky Kuvend, do të jetë pak a shumë ajo që ishte prej një dekade me ca zbukurime të vogla.”Koha e shqiptarëve ka ecur përpara dhe e ka lënë PD-në pas. PD sot duhet të kapë të ardhmen. Për këtë arsye, dua t’i bëj thirrje edhe një herë tjetër Zotit Berisha që të hapë rrugën për një brez tjetër në krye të PD-së, i cili mund të vijë nga një garë e lirë dhe e vërtetë. Një garë ku merr pjesë zoti Berisha nuk është garë e vërtetë”, u shpreh Kadilli. Sot Kuvendi po voton për zgjedhjen e Këshillit kombëtar, nga i cili do të burojnë institucionet e tjera drejtuese e që si detyrë të parë, iu la të zgjedhë dhe drejtuesin e ri të grupit parlamentar. Zoti Berisha dhe mbështetësit e tij nuk e njohin dretimin e grupit nga Enkelejd Alibeaj, pasi ky i fundit ankimoi në Apel vendimin e gjykatës së Tiranës që njohu Kuvendin e 11 dhjetorit të organizuar nga zoti Berisha. Grupi parlamentar mbetet ende struktura mbi të cilën ish kryeministri nuk e ka nën kontroll. Shumica dërrmuese e deputetëve nuk iu bashkuan Kuvendit të sotëm, një dëshmi e faktit se ribashkimi i demokratëve mbetet ende një mision i vështirë.",Zgjedhjet për kryetarin e ri më 22 maj. Ish kryeministri Berisha flet si drejtues de facto i Partisë. Kadilli: Një garë ku merr pjesë zoti Berisha nuk është garë e vërtetë
"Qyteti i Varoshës në bregdetin lindor të Qipros, ishte dikur një vend turistik luksoz, por që kur ky ishull u nda para 40 vjetësh, ka mbetur si një qytet fantazëm. Së fundmi, një grup aktivistësh dhe ekspertësh nga të dyja pjesët kanë bashkëpunuar për një projekt për ta kthyer qytetin fantazëm në një qytet të qëndrueshëm nga ana ekologjike. Qyteti fantazëm i Varoshës. Hotele në buzë të detit, të lëna pas dore dhe shtëpi të rrënuara nga lufta. Dikur, gardhe të bukura rrethonin hotele turistike luksoze ku thuhet se pushonin yjet e Hollivudit, që nga Elizabeth Taylor, Richard Burton dhe Brigitte Bardot. Sot, nën kontrollin e ushtrisë turke, qyteti është pothuajse i shkretuar. Ish-banori i qytetit, Marios Kosma ishte 24 vjeç kur u detyrua të largohej dhe që atëherë nuk e ka parë shtëpinë e familjes së tij. I ngritur në bregun lindor të Qipros, Varosha ishte lagjia moderne e turistëve në distriktin e Famagustës. E njohur për plazhet me rërë të bardhë dhe ujrat e ngrohta të kaltra, ishte banuar tradicionalisht nga qipriotët grekë. Ngjitur me të, qyteti i lashtë mesjetar, i rrethuar me mure i Famagustës banohej nga qipriotët turq. Marios e mban mend kur la qytetin, javën e parë të gushtit 1974, së bashku me qipriotë të tjerë grekë nga Famagusta që ndjeheshin të rrezikuar. Ai thotë se qyteti u braktis para se të arrinte ushtria turke, duke mbetur i zbrazët dhe gati për t’u marrë nën kontroll para saj. Ayla Gurel është Konsulente Studimesh në Institutin e Oslos për Kërkimet e Paqes dhe specialiste për konfliktin e Qipros. Ajo shpjegon se fillimisht ushtria turke ushtria turke nuk kishte si synim të pushtonte Varoshën. Ndryshe nga zonat e tjera të veriut ku qipriotët turq dhe turqit e Turqisë ranë dakord, Varosha mbeti e zbrazët pasi u pushtua. Zonja Gurel thotë se ishte një lëvizje e qëllimshme për të forcuar pozitën negociuese të qipriotëve turq në biseda të ardhshme për territor dhe prona. Por qyteti fantazëm vazhdon të jetë një pikë delikate për qipriotët turq. Është një kujtesë e hidhur për tragjedinë e luftës së vitit 1974. Dhe fatura sa vjen e rritet, pasi Turqia është e detyruar nga gjykatat ndërkombëtare të kompensojë ish-banorët për humbjet nga mospërdorimi i pronave të tyre. Që nga viti 1974, janë bërë disa përpjekje për të negociuar dorëzimin e Varoshës, ose si pjesë e një zgjidhjeje të përgjithshme, ose si masë për vendosjen e besimit mes veriut turk të Qipros, me jugun grek-qipriot që njihet në shkallë ndërkombëtare. Ceren Bogac, një arkitekte turko-qipriote është rritur në një shtëpi nga ku shihet qyteti fantazëm, dhe kjo ka lënë një gjurmë të thellë në jetën e saj. Familja e saj ishte zhvendosur në Framagusta nga Larnaca në jug pas marrëveshjes së vitit 1975 për këmbimin e popullsisë dhe iu dha një apartament pranë kufirit të qytetit të rrethuar. Tani, banorë nga të dyja anët e Famagustës kanë vendosur të veprojnë. Një nga nismat quhet Projekti i Qytetit Ekologjik të Famagustës. Një grup arkitektësh, planifikues urbanë, udhëheqës të biznesit, ekspertë të energjisë dhe aktivistë të paqes shpresojnë të ngrenë një qytet të tërë për të korrigjuar gabimet e së shkuarës dhe për të krijuar një ambjent ekologjik. Ideja erdhi nga greko-amerikania nga Qipro Vasia Markides. Markides dhe arkitektja Bogac, e cila ishte gjithashtu pjesë e grupit nismëtar mblodhën një grup ekspertësh për të diskutuar idenë në vitin 2014. Jo të gjithë janë dakord me idenë dhe ndërsa bisedimet e paqes kanë ngecur për momentin, projekti është më shumë një ushtrim akademik. Tani për tani organizatorët thonë se projekti ka si synim të vendosë ura komunikimi mes banorëve të dikurshëm dhe aktualë të Famagustës dhe Varoshës.","Që kur u nda Qipro para 40 vjetësh, qyteti i Varoshës, dikur një vend turistik luksoz, ka mbetur i shkretuar"
"Gjendja është shumë e rëndë në shumë pjesë të Afganistani, ku Pogrami Botëror i Ushqimit, një organizatë ndihmash e OKB-së, thotë se pothuajse 24 milionë njerëz, ose 60% e popullsisë, vuajnë nga uria akute. Zëdhënësi i Departamentit të Shtetit Ned Price tha se Përfaqësuesi Special, Tom West do të diskutojë çështje me interes jetik kombëtar për Shtetet e Bashkuara, duke përfshirë çështjet e kundërterrorizmit dhe ndihmat humanitare, në takimet me udhëheqësit talebanë në Doha të Katarit. Në një intervistë ekskluzive me Zërin e Amerikës të martën, zoti West tha se përkeqësimi i krizës humanitare në Afganistan ka të bëjë shumë me bllokimin e ndihmës ndërkombëtare. Ekonomia afgane varej nga kjo ndihmë në një masë të madhe gjatë 20 viteve të fundit. tha i përfaqësuesi special amerikan për Afganistanin. Javën e kaluar, zëdhënësi i Ministrisë së Jashtme të talebanëve i bëri thirrje Kongresit amerikan që të zhbllokojë pasuritë afgane të bllokuara pas rënies së Afganistanit në duart e talebanëve. Ai tha se mjerimi ekonomik në vend mund të nxisë një eksod masiv dhe mund të shkaktojë probleme refugjatësh për vendet e tjera. Diplomati West tha se nuk është aq e thjeshtë, siç mund mendojnë talebanët, për të marrë përsëri ndihmat që tashmë janë të bllokuara në Shtetet e Bashkuara dhe vende të tjera. tha ai. Ka patur përparim të kufizuar në disa rajone të Afganistanit drejt plotësimit të kërkesave të Shteteve të Bashkuara dhe komunitetit ndërkombëtar nga talebanët për respektimin e të drejtave të njeriut dhe atyre të grave. Shkollat për vajzat nga klasa 7 deri në të 12 janë rihapur në qytetin e tretë më të madh të Afganistanit, Herat.","Përfaqësuesi Special për Afganistanin, Thomas West, i tha Zërit të Amerikës se Shtetet e Bashkuara janë thellësisht të shqetësuara për krizën humanitare në Afganistan. "
"Presidenti i Shteteve të Bashkuara, Donald Trump kërcënoi të hënën se do të vendosë tarifa të tjera ndaj mallrave të importuara nga Kina, me vlerën prej 325 miliardë dollarëve, nëse presidenti kinez Xi Jinping nuk angazhohet në bisedime të reja tregtare me të këtë muaj. Zoti Trump i tha rrjetit televiziv CNBC, se ai pret të takohet në qershor, me zotin XI në Osaka, të Japonisë, në takimin e G-20-ës, udhëheqësve të ekonomive më të mëdha në botë, që mbahet më 28- 29 qershor, por Pekini nuk e ka konfirmuar publikisht takimin. Presidenti Trump tha se do t’i vendoste tarifat e reja, përveç tarifave që ai tashmë ka vënë ndaj eksporteve kineze me vlerën prej 200 miliardë dollarëve, nëse zoti Xi e anashkalon takimin. ""Unë mendoj se ai do të vijë në takim,"" tha zoti Trump. ""Pritet që ne të takohemi."" Udhëheqësi amerikan u shpreh se: ""Kina dëshiron shumë të kemi një marrëveshje, më shumë se sa unë."" Por muaj të tërë bisedimesh tregtare midis dy ekonomive më të mëdha në botë kanë ngecur, të paktën për momentin. Uashingtoni e ka akuzuar Pekinin se nuk e ka mbajtur fjalën, për çështje për të cilat të dyja palët kishin rënë më parë dakord, por Kina e ka hedhur poshtë këtë. Ministria e Jashtme e Kinës tha: ""Ne nuk duam një luftë tregtare, por ne nuk kemi frikë të përfshihemi në të. Nëse SHBA janë të gatshme që të ketë konsultime në pozita të barabarta, dera jonë është e hapur. Por në se ai këmbëngul t'i shkallëzojë tensionet, ne do të përgjigjemi me vendosmëri dhe këmbëngulje. "" Kërcënimi i zotit Trump për tarifat kineze erdhi mes shqetësimit në rritje nga disa udhëheqës të biznesit, të cilët vunë në dyshim nëse ai është duke i keqpërdorur tarifat - ose kërcënimin e imponimit të tyre - në mënyra që mund të dëmtojnë ekonominë e amerikane. Presidenti Trump të premten e tërhoqi një kërcënimin për të imponuar një tarifë prej 5% ndaj importeve meksikane, nëse fqinji i saj jugor nuk i shton përpjekjet për të frenuar rritjen e emigrantëve të Amerikës Qendrore që udhëtojnë nëpër Meksikë në Shtetet e Bashkuara. Të dy vendet arritën një marrëveshje për të patur kontrolle më të forta për emigracionin. Sekretari amerikan i Thesarit, Steven Mnuchin, tha të dielën se Presidenti Trump do të ishte ""plotësisht i lumtur"" për të vendosur taksa të tjera ndaj importeve nga Kina, nëse ai nuk do të mundet të arrijë një marrëveshje tregtare me zotin Xi. ""Ne kemi bërë përparim të madh, mendoj se kemi pasur një marrëveshje që është përfunduar pothuajse 90 për qind,"" tha zoti Mnuchin në një intervistë për rrjetin CNBC. ""Kina dëshironte të bënte hapa prapa për disa çështje. Unë besoj që nëse Kina është e gatshme të bëjë përparim në kushtet që kemi diskutuar, do të kemi një marrëveshje. Nëse kinezët nuk janë të gatshëm, do të vazhdojmë me tarifat,""- tha Sekretari Mnuchin. Në takimin e ministrave të Financave të G-20-ës në Fukuoka, të Japonisë gjatë fundjavës, u tha se konfliktet tregtare dhe gjeopolitike po rrezikojnë rritjen e ekonomisë globale, por me këmbënguljen e Shteteve të Bashkuara, u hoq një thirrje për "" të njohur nevojën urgjente për zgjidhjen e tensioneve tregtare"". ""Rritja globale duket të jetë stabilizuar dhe në përgjithësi parashikohet të rritet mesatarisht më vonë këtë vit dhe deri në vitin 2020,"" thanë në një komunikatë të përbashkët përfundimtare shefat e financave, duke përfshirë zotin Mnuchin. ""Sidoqoftë, rritja është e ulët dhe rreziqet mbeten. Më e rëndësishmja, tensionet tregtare dhe ato gjeopolitike janë intensifikuar dhe ne do të vazhdojmë t'i trajtojmë këto rreziqe dhe të jemi gati për të ndërmarrë veprime të mëtejshme""- thuhet në deklaratë. Fondi Monetar Ndërkombëtar paralajmëroi javën e kaluar se ngërçi i vazhdueshëm mes SHBA-së dhe Kinës për çështjen e tarifave mund ta ulë rritjen e ekonomisë globale në vitin 2020 me 0,5 përqind. Ndërkohë, Kina u zotua të dielën për të ndërtuar atë që e quan “një mur mbrojtës” të fuqishëm kundër përpjekjeve për të kufizuar aftësinë e saj për të përparuar në teknologji. Kina planifikon t’i njoftojë detajet e planeve të saj në të ardhmen e afërt. Deklarata kineze nuk përmend asnjë vend me emër, por Shtetet e Bashkuara i kanë kufizuar firmat amerikane që t’i shesin teknologji kompanisë teknologjike kineze Huawei, duke dyshuar se kjo kompani ndërton programe kompjuterike të piraterisë kibernetike në produktet e saj të telekomunikacionit. Shtetet e Bashkuara gjithashtu i kanë paralajmëruar aleatët e tyre kundër rrezikut që mendohet të kenë nga blerja e teknologjisë tek firma Huawei. Presidenti Trump tha se shqetësimet për kompaninë Huawei mund të trajtohen me një marrëveshje të re tregtare.","Presidenti amerikan e kushtëzoi këtë veprim të tijin me gatimërinë për t'u takuar me të, të Presidentit kinez Xi Jinping për bisedime të reja tregtare ."
