text,summary
"Intervistë me zotin Veton Surroi, themelues i lëvizjes Ora. Zoti Surroi, me çfarë platforme po del lëvizja juaj në këto zgjedhje? Ne kemi një platformë të transformimit të Kosovës brenda një periudhe jo më të gjatë se 12 muaj, në të cilën do të përpiqemi të vendosim shtetin e së drejtës, të fillojmë një cikël investimesh prej 300 milion eurosh, që do të hapë vende të reja pune, për menaxhim të plotë të rrjedhave ekonomike në Kosovë. Ne kemi një platformë të transformimit të Kosovës në një shtet demokratik me një sovranitet të brendshëm. Çështja e statusit natyrisht do të mbetet çështje e hapur brenda një përgjigjeje negociatore me bashkësinë ndërkombëtare. Zoti Surroi, shpesh në programin Ditari ju keni komentuar dhe bërë vërejtje për mënyrën si janë trajtuar problemet në Kosovë. Çfarë synoni ju të ndryshoni? Unë mendoj se së pari duhet vendosur një bosht kurrizor ligjor në Kosovë; duhet të bëhet unifikimi i të gjitha ligjeve në një sistem ligjor kosovar. Së dyti, duhen marrë përsipër kompetencat që janë të drejta të fituara të Kosovës, pra që nuk janë të negociueshme, siç janë banka qendrore, ministritë e ndryshme, përfshirë edhe atë të tregtisë etj. Dhe së treti, duhet rikonstituar politika, në mënyrë që ajo të vihet në shërbim të qytetarëve dhe jo të jetë pjesë e negociatave mes UNMIK-ut dhe forcave të ndryshme politike. Zoti Surroi, një nga problemet kryesore që lidhet me zgjedhjet është pjesëmarrja e komunitetit serb. Beogradi, të paktën një pjesë e politikanëve, u bënë thirrje banorëve serbë të marrin pjesë në votime, ndonëse me kushte, që pala shqiptare menjëherë i hodhi poshtë. Udhëheqësit shqiptarë janë kritikuar dhe prej tyre kërkohet krijimi i një shoqërie funksionale shumë etnike. A po e humbet Kosova betejën për krijimin e një shoqërie të tillë? Dhe çfarë ofron lëvizja juaj për përmirësimin e gjendjes së banorëve serbë, si një prej standarteve kryesore? Unë mendoj se shoqëria kosovare deri tani ka humbur betejën në sferën politike për sigurimin e kushteve të nevojshme për shumicën, le të mos flasim për pakicën. Dhe ajo që është esenciale, është se pakica nuk mund të jetë mirë, nëse shumica nuk është mirë. Në Kosovë duhet ndryshuar tërësisht dhe me masa të shpejta mënyra se si udhëhiqet vendi. Ne duhet të sigurohemi që ky vend të jetë funksional, dhe brenda një vendi funksional natyrisht që duhet hapur një debat i sinqertë me minoritetet, në mënyrë që të sigurohet inkuadrimi i tyre. Kjo formë nuk do t’i sigurojë Beogradit as të drejtat e serbëve dhe as nuk do të lejojë hapjen e dialogut mes kosovarëve shqiptarë dhe kosovarëve serbë. Kjo thjesht do të të krijojë mundësi që Beogradi të përfshihet në mënyrë të përhershme në procesin e konsolidimit e kostituimit të Kosovës si shtet. Zoti Surroi, ju jeni një lëvizje e re, e krijuar vetëm disa muaj më parë, që do të konkuroni ndaj disa partive që kanë një përvojë disa vjeçare. Cilat janë synimet tuaja për këto zgjedhje, a synoni të merrni shumicën, apo të përfaqësoheni në parlament, dhe përse banorët duhet të votojnë për lëvizjen tuaj? Së pari, ajo që duhet të bëjmë është të mos përsërisim gabimet që kanë bërë partitë e deritanishme, të cilat janë marrë kryesisht me debate boshe gjatë këtyre viteve të kaluara. Ne premtojnë se do të futemi drejt për së drejti në çështje që janë themelore për funskionimin e kësaj shoqërie, si për shembull çështjet e punësimit, cikli i investimeve, transformimi rrënjësor i bujqësisë, stimulimi i ekspertëve kosovar etj. Ne po flasim për vende të reja pune të cilat dalin nga ky cikël i transformimit ekonomik të Kosovës. Dhe kjo nuk do të thotë një shtet iluzor, por një vend i cili brenda vitit 2006 duhet të ketë kushtetutën e vet dhe jo siç ka ndodhur deri tani me këto parti të cilat e kanë degraduar pozitën kushtetuese dhe ligjore të Kosovës me anë të kornizës kushtetuese dhe me një mungesë vizioni të arsyeshëm të zhvillimit ligjor, ekonomik e të tjera të Kosovës. Edhe një pyetje e fundit, lëvizja Ora merr pjesë në zgjedhje si një lëvizje qytetare, madje edhe ju vetë nuk quheni kryetar i saj por bartës i listës zgjedhore. A mundet të jetë një lëvizje qytetare më e aftë se një parti politike për të zgjidhur problemet e Kosovës? Po kjo është forcë politike vetvetiu, pavarësisht se nuk quhet parti. Atë që ne kemi deri tani është përvoja e debatit, dhe qytetarët gjithnjë e më shumë kanë filluar të besojnë dhe të kuptojnë se cili është thelbi i porosisë tonë. Ne kemi zhvilluar debat me bujqit, me bankat, me studentët etj., dhe nga këto debate rrjedh një program efikas i transformimit të Kosovës në shtet. Ne me këto programe dhe këtë përkrahje, që po grumbullojmë dita ditës, besoj se do të jemi në gjendje të formojmë një qeveri efikase pas zgjedhjeve të 23 tetorit. Ju sapo thatë pak më parë se nuk do ta lini fatin e Kosovës në duart e bisedimeve mes Prishtinës me Beogradin, cili është qëndrimi juaj në lidhje me bisedimet Prishtinë - Beograd, kur duhet të zhvillohen ato dhe a duhet të zhvillohen apo jo? Ato duhet të zhvillohen patjetër, pas zgjedhjeve dhe me një qeveri të konsoliduar. Në bisedime duhet të hapen të gjitha çështjet që janë brengosëse dhe për të cilat ne mendojmë se duhet biseduar. Ne, pikë së pari, duhet të bisedojmë për të gjitha dëmet që ka shkaktuar Serbia në Kosovë, që nga koha e aparteidit dhe deri në periudhën e luftës. Duhet të shtrohen çështje jo si kornizë teknike, siç është bërë deri sot, por si çështje reale politike që kërkojnë zgjidhje. Disa prej çështjeve janë të panegociueshme, siç është çështja e të zhdukurve kosovar, e cila nuk është as çështje teknike dhe as çështje bisedimesh, por është thjesht çështje e rregullimit të kohës dhe mënyrës se si të kthehen të gjithë të zhdukurit kosovar në atdhe. Çështja e dëmeve të luftës është një çështje e cila duhet të shtrohet dhe gjithashtu çështja e fondit pensional të Kosovës të cilën e vodhi regjimi i Millosheviçit.",Drejtuesi i lëvizjes Ora: Politika duhet të vihet në shërbim të qytetarëve dhe jo të jetë pjesë e negociatave mes UNMIK-ut dhe forcave
"Një sërë sulmesh kundër pakicave fetare në Gjeorgji ka tërhequr vëmendjen lidhur me keqësimin e gjendjes së të drejtave të njeriut në këtë ish-republikë sovjetike. Autorët e një prej këtyre sulmeve, që mendohet të jenë anëtarë të grupit ekstremist ortodoks gjeorgjian Xhivari, dogjën qendrën fetare të mbledhjeve të grupit Dëshmitarët e Jehovait. Në një sulm tjetër, autorët e tij shkatërruan banesën ngjitur me vendin ku do të mbahej takimi vjetor i grupit Dëshmitarët e Jehovait, në qytetin Kaspi. Këto nuk ishin kurrsesi incidente të izoluara. Në të vërtetë dhuna kundër grupeve të pakicave fetare, sidomos kundër grupit Dëshmitarët e Jehovait, është rritur së tepërmi gjatë tre vjetëve të fundit. Sipas raportit të Departamentit amerikan të Shtetit mbi lirinë ndërkombëtare fetare, gjatë vitit të kaluar në Gjeorgji zyrtarë të policisë lokale dhe të sigurimit vazhduan të përndjekin grupe të pakicave fetare jotradicionale, në mënyrë të veçantë misionarë vendas e të huaj dhe kanë qenë bashkëpunëtorë, ose në disa raste kanë marrë pjesë ose kanë krijuar kushtet për sulme kundër anëtarëve të këtyre grupeve. Për më tepër policia e Gjeorgjisë nuk ka reaguar në rastin e sulmeve kundër anëtarëve të grupit Dëshmitarët e Jehovës dhe pakicave të tjera fetare, nga ana e ekstremistëve ortodoksë, kryesisht pasues të At Basil Mikalavishvilit, një prift ortodoks i çkishëruar. Në një rast një turmë sulmoi një kishë të Rëshajave, kur kori i kishës bënte prova, dhe plagosi 12 veta. Viktimat e sulmeve të tilla kanë ngritur mbi 700 padi penale, por autoritetet gjeorgjiane nuk kanë bërë asgjë për të ndalur dhunën. Askush nuk është mbajtur përgjegjës për këto akte dhe as dënuar.//ic// Veprimtarë të të drejtave të njeriut kanë qenë gjithashtu në shënjestër. Në korrik, në kryeqytetin e Gjeorgjisë, Tbilisi, një bandë personash të paidentifikuar sulmuan zyrat e Institutit të Lirisë, duke rrahur punonjësit e tij dhe duke shkatërruar pajisjet. Instituti i Lirisë është një nga grupet kryesore të të drejtave të njeriut në Gjeorgji dhe ka kundërshtuar me forcë shtimin e dhunës së turmave kundër pakicave fetare. Shoqëria civile është rritur në mënyrë të ndjeshme në Gjeorgji, qëkurse ky vend fitoi pavarësinë nga Bashkimi Sovjetik më 1991. Por dhuna e turmave kundër pakicave fetare, në se lejohet të vazhdojë, mund ta përmbysë përparimin drejt respektimit të të drejtave të njeriut dhe pushtetit të ligjit në Gjeorgji. Është një parim themelor i demokracisë që qytetarët kanë të drejtë për mbrojtje të barabartë përpara ligjit. Dhe kjo sigurisht do të thotë ndalim i dhunës kundër pakicave fetare në Gjeorgji.","Zyrtarë të policisë lokale dhe të sigurimit kanë përndjekur grupe të pakicave fetare jotradicionale, në mënyrë të veçantë misionarë ven"
"Zgjedhjet e parakohëshme në Turqi ka të ngjarë të shoqërohen me përplasje mes Ankarasë dhe autoriteteve të Austrisë, Gjermanisë dhe Hollandës që kanë thënë se nuk do të lejojnë fushatë zgjedhore në vendet e tyre ku ka një popullsi të konsiderueshme emigrantësh nga Turqia. Nga ana e tij, Presidenti Erdogan ka sinjalizuar se mund të thyejë emgargon e tyre elektorale. “Nuk do e përmend vendin përkatës, por do t’u flas qytetarëve turq në një palestër në Evropë, që zë rreth 10 mijë vetë,” tha presidenti turk. Gjermania e ka shprehur hapur qëndrimin e saj për synimet e presidentit turk për fushatë: “Ne mbajmë një qëndrim të fortë në këtë drejtim. Fushata në interes të një vendi tjetër në Gjermani nuk lejohet tre muaj para zgjedhjeve” tha ministri i jashtëm gjerman Heiko Maas. Qeveritë austriake dhe hollandeze po zbatojnë rregullore të ngjashme. “Fjalimet e politikanëve turq në kuadër të fushatës nuk janë të mirëpritura në Austri dhe nuk do të lejohen,” tha Kancelari austriak Sebastian Kurz. “Nga njëra anë bllokojnë ushtrimin e një prej të drejtave më themelore, nga ana tjetër kritikojnë ato që i quajnë zhvillime negative në demokracinë turke,” reagoi ministri turk për marrëdhënie me Bashkimin Evropian, Omer Celik. Ndalimi i aktivitetit për fushatë në Evropë shihet si një goditje ndaj përpjekjeve të Erdoganit për rizgjedhje. “Erdogani ka një stil shumë konkret, do që ta shohin zgjedhësit. Ai beson se ka përkrahës të shumtë në Evropë,” thotë analisti politik Semih Idiz i cili shkruan për portalin elektronik Al-Monitor. ""Votuesit në Evropë janë shumë të rendësishëm pasi ka një numër të madh emigrantësh me të drejtë vote. Ndoshta 4.5 milionë vetë. Ndikimi i tyre nuk mund të injorohet,” thotë opinionisti. Analistët thonë se votuesit turq në Evropë kanë prirjen të mbështesin Erdoganin dhe partinë e tij AKP. Ata shtojnë se kjo përkrahje mund të ketë rëndësi vendimtare në zgjedhjet e qershorit. Referendumi i vjetshëm për ta shndërruar Turqinë në presidencë ekzekutive solli krizë në marrëdhëniet Ankara-BE. Hollanda dhe Gjermania shprehën kritika të forta në veçanti dhe bllokuan planet për tubime pasi autoritetet shprehën shqetësim se aktivitete të tilla mund të acaronin tensionet. Presidenti turk u përgjigj duke i akuzuar dy vendet se po silleshin si regjime naziste. Analistët thonë se retorika e fortë e Erdoganit në këtë acarim e fuqizoi fushatën e tij dhe solli si rezultat miratimin e referendumit. Disa vëzhgues thonë se ndalimi i aktiviteteve elektorale për zgjedhjet e ardhshme mund të rezultojë në favor të Erdoganit: “Vështirë të besosh se Gjermania, Austria, autoritetet hollandeze nuk e kuptojnë se duke ia vështirësuar fushatën partisë AKP, e shtojnë përkrahjen për këtë forcë politike dhe i sigurojnë fitoren udhëheqësit të saj,” thotë opinionisti Barcin Yinanc, i cili shkruan për të përditshme .",Analistët thonë se ndalimi në tre vende evropiane i aktiviteteve elektorale për zgjedhjet e ardhshme turke mund të shërbejë për të rritur përkrahjen për partinë AKP të Presidentit Erdogan.
"Vandalët vizatuan shenjën e kryqit të thyer nazist në dyert e ambasadës polake në Tel Aviv, një veprim që pason komentet e ditëve të fundit nga kryeministri polak Mateusz Morawiecki në të cilat ai përdori shprehjen ""keqbërësit hebrenj"" të Holokaustit. Vandalët vendosën mbishkrime me të shara në dyert e ambasadës polake në Izrael. Policia tha se ka nisur një hetim mbi incidentin dhe është në kërkim të të dyshuarve. Izraelitët janë të zemëruar me një ligj të ri në Poloni që dënon këdo që e quan gjenocidin nazist një ""krim polak"". Polemika shpërtheu të shtunën kur një gazetar në Konferencën e Sigurisë në Mynih e pyeti kryeministrin polak Morawieckin nëse ai mund të burgoset për tregimin e historisë se si fqinjët e familjes raportuan nënën e tij tek nazistët në Poloni. Udhëheqësit izraelitë dënuan menjëherë komentin e udhëheqësit polak. tha Presidenti izraelit, Rueven Rivlin. Zëdhënësi i kryeministrit polak Morawiecki tha se ai në asnjë mënyrë nuk ishte përpjekur ta mohonte Holokaustin. Rreth 6 milionë polakë, gjysma prej tyre hebrenjë, u vranë gjatë Luftës së Dytë Botërore nga nazistët. Zyra e kryeministrit izraelit, Benjamin Netanjahu, tha se ai kishte zhvilluar një bisedë telefonike me homologun e tij polak të dielën, duke i thënë atij se",Tensionet mes Polonisë dhe Izraelit janë rritur pas komenteve të debatueshme të kryeministrit polak mbi Holokaustin
"Vazhdojnë reagimet lidhur me gjuhën e përdorur nga Presidenti Donald Trump dje gjatë një takimi në Shtëpinë e Bardhë për imigracionin, ku, sipas njoftimeve ai iu referua Haitit dhe vendeve afrikane me një fjalë të papërshtatshme. Zoti Trump i habiti ligjvënësit të enjten gjatë takimit me ligjvënësit për imigracionin, kur iu referua Haitit dhe vendeve afrikane me një fjalë të papërshtatshme. ""Pse i pranojmë gjithë këta njerëz nga vende (...) të vijnë këtu"", pyeti presidenti, sipas një njoftimi që u raportua për herë të parë nga gazeta Washington Post dhe u konfirmua nga televizioni CNN. Fjala e përdorur prej tij mund të përkthehet afërsisht si “të pista dhe të varfra”. Zoti Trump tha se Shtetet e Bashkuara duhet të lejojnë më shumë njerëz nga vende të tilla si Norvegjia, kryeministrja e së cilës u takua me të në Shtëpinë e Bardhë të mërkurën. Por sot, në një koment në Twitter, Presidenti mohoi të kishte përdorur fjalët të cilave po i refererohen mediat: shkruante zoti Trump. Presidenti iu referua programit, që mbron nga deportimi rreth 800 mijë emigrantë të rinj, të sjellë në SHBA ilegalisht nga prindërit e tyre kur ishin fëmijë. Sipas njoftimeve, Presidenti Trump i bëri komentet kur senatori Dick Durbin, demokrat nga shteti Ilinoi, po shpjegonte kuadrin e një marrëveshjeje të arritur nga gjashtë senatorë të të dyja partive, e cila që synon mbrojtjen nga deportimi të këtyre emigrantëve të rinj, si dhe forcimin e sigurisë së kufirit. Presidenti reagoi sot në Twitter duke thënë se ai iu referua vendeve me rezultate të këqia dhe se ai kërkon një sistem imigracioni të bazuar mbi meritën, për të sjellë njerëz që e çojnë përpara Amerikën shkruante Presidenti Trump. E pyetur nga mediat, përfshirë Zërin e Amerikës, Shtëpia e Bardhë lëshoi një deklaratë ku thuhej se presidenti do të pranojë vetëm një marrëveshje emigracioni që ""trajton si duhet sistemin e llotarisë së vizave dhe emigracionin zinxhir"" - dy programe të cilat dëmtojnë ekonominë tonë dhe lejojnë terroristët në vend.” Imigracioni zinxhir është një term i përdorur nga kritikët e imigracionit, të cilët i referohen sistemit që lejon të afërmit të sponsorizojnë anëtarët e familjes për të ardhur në Shtetet e Bashkuara. Shtëpia e Bardhë nuk konfirmoi dhe as nuk mohoi nëse Presidenti kishte përdorur fjalën e papërshtatshme kur kishte folur për Haitin dhe Afrikën. Në deklaratë thuhej gjithashtu se Presidenti Trump gjithmonë do të refuzojë ""masat e përkohshme dhe të dobëta që u krijojnë pengesa atyre emigrantëve të cilët kërkojnë një jetë më të mirë në Shtetet e Bashkuara nëpërmjet një rruge të ligjshme.” Gjithashtu, Zëri i Amerikës u interesua pranë zyrave të ligjvënësve që thuhet se ishin të pranishëm në takim.",Presidenti reagoi pas komenteve të mediave se ai kishte përdorur gjuhë vulgare gjatë një takimi të enjten në Shtëpinë e Bardhë kur iu referua Haitit dhe vendeve afrikane
"Me politikën e saj, Serbia duket gjithnjë e më tepër si në epokën e Millosheviçit pa Millosheviçin, thuhet në një raport të Grupit Ndërkombëtar të Krizave. Reagimi i saj ndaj trazirave të këtij muaji në Kosovë, të cilat gati sa nuk shkaktuan dështimin e UNMIK-ut, mbështetja e madhe për ultranacionalistët në zgjedhjet parlamentare të 28 dhjetorit dhe vështirësitë për gati dy muaj të partive politike për formimin e një qeverie koalicioni, janë shenja që tregojnë se Serbinë e presin akoma shumë probleme. Në vitin 2004, Serbia mund të përballet me një paqëndrueshmëri politike, keqësim të vazhdueshëm të mardhënieve me perëndimin dhe rënie të vazhdueshme të ekonomisë. Spastrimi etnik i serbëve nga shqiptarët në Kosovë, thuhet më tej në raportin e Grupit Ndërkombëtar i Krizave, ka ngjallur përsëri perspektivën e ndarjes së Kosovës, ka përforcuar ndjenjat nacionaliste të radikalëve si dhe ndjenjat anti- perëndimore. Paqëndrueshmëria dhe gjendja e vështirë ekonomike mund të përshpejtojnë hapat e Malit të Zi drejt pavarësisë, ndërkohë që tensionet në Kosovë mund të përhapen në luginën e Preshevës, në rajonin e Sanxhakut dhe madje deri në Vojvodinë. Këto perspektiva duhet ta nxisin komunitetin ndërkombëtar që të rishikojë politikën ndaj Serbisë. Gjithashtu ndihmat duhet të kushtëzohen më shumë. Qeveria e re e Serbisë mund të jetë shumë jetëshkurtër. Kjo qeveri ka divergjenca të brendshme serioze dhe statusi i saj i pakicës ia bën asaj të pamundur marrjen e vendimve të rëndësishme ekonomike, të nevojshme për ringjalljen e ekonomisë dhe sidomos nëse nuk merr ndihma të konsiderueshme nga jashtë. Sidoqoftë, masat e para të kësaj qeverie, tregojnë se ajo është më e qëndrueshme dhe mund të mbijetojë më gjatë se sa parashikohet. Trazirat e Kosovës kanë qenë një faktor bashkimi, megjithëse i përkohshëm. Ngjarjet në Kosovë kanë larguar vëmëndjen e institucioneve evropiane ndaj Serbisë dhe kanë dëmtuar besueshmërinë e Bashkimit Evropian, OKB-së Shteteve të Bashkuara dhe NATO-s, thuhet më tej në raport. Partitë të cilat ose e kundërshtojnë ose janë skeptike ndaj integrimit evropian përbëjnë 71 përqind të parlamentit. Partia Radikale Serbe ka një të tretën e anëtarëve të çdo komisioni parlamentar. Forcat anti-reformiste në bllokun e ashtuquajtur demokrat duket se synojnë të ndalojnë masat e filluara në kohën e qeverisë së Gjingjiqit, madje radikalët kërkojnë kthimin prapa. Ekonomia dhe Kosova krijojnë një presion të madh për qeverinë dhe Partia Radikale ka shumë të ngjarë të përfitojë në zgjedhjet e ardhshme presidenciale dhe vendore nga çdo pakënaqësi e popullit. Për t’u bërë një vend i qëndrueshëm, Serbia duhet të bëjë dy ndryshime të ndjeshme, thuhet në raport. I pari është kalimi nga një shtet kriminal i kohës së Millosheviqit në një shoqëri më normale. I dytë është kalimi klasik Evropianolindor nga një ekonomi e kontrolluar nga shteti në një ekonomi të tregut të lirë. Ndryshimi i dytë nuk do të ndodhë në qoftë se nuk bëhet përparim në ndryshimin e parë. Është pikërisht dështimi për të spastruar trashëgiminë e Millosheviçit në Serbit, sidomos në shërbimet e sigurimit, që ka bërë rikthimin e të djathtës ekstreme dhe ndaljen e reformave. Ndihma e komunitetit ndërkombëtar duhet të përqendrohet në përpjekjet për kalimin drejt një shoqërie më normale. Fatkeqësisht, qeveria e re ka dhënë shenja se është më e interesuar të zhdukë trashëgiminë e Gjingjiçit se sa të Millosheviçit. Po bëhet gjithnjë e më e qartë se 5 nëntori i vitit 2000, dita kur u rrëzua regjimi i Millosheviçit ishte më pak revolucionar se sa u duk atëherë. Shumë nga demokratët e Serbisë pranuan mitin e kohës së Millosheviqit se të gjitha të këqijat e vendit vinin nga një dekadë luftërash, sanskionesh ndërkombëtare dhe bombardimeve të NATO-s. Shumë demokratë treguan pak entuziazëm për reforma dhe në shumë raste i bllokuan ato. Strukturat e kohës së Millosheviqit janë akoma të paprekura në gjykata, polici, ushtri dhe institucione të tjera të rëndësishme. Media serbe është më pak e pavarur sot se sa ishte dy vjet më parë. Sot në Sërbi është pothuajse aq vështirë të bëhet biznes sa në kohën e Millosheviqit, gjë kjo e dëshmuar nga investimet e pakëta të huaja në këtë vend. Institucionet e vetme që duken të funksionojnë deri diku normalish janë ushtria dhe Banka Kombëtare. Ndërkohë mungesa e statusit përfundimtar të Kosovës do të vazhdojë të mjegullojë politikën e brendshme dhe të pengojë dialogun politik normal. Së shpejti Grupi Ndërkombëtar i Krizave do të publikojë një raport të veçantë mbi ngjarjet e marsit të vitit 2004 në Kosovë dhe ndikimin e tyre në të ardhmen e saj dhe politikën ndërkombëtare në përgjithësi në rajon.//kk//",Grupi Ndërkombëtar i Krizave bën parashikime pesimiste për gjendjen e Serbisë në vitin 2004
