text,summary
"Anija Diskavëri u hodh me sukses në orbitë dje në mëngjes, por janë ngjallur shqetësime rreth disa ciflave që ranë nga anija kur ajo u ngrit nga platforma. Anija Diskoveri u hodh në hapësirë nga Qendra e Hapësinës Kenedi në Florida, më shumë se dy vjet pasi Nasa ndaloi misionit e anijeve për vajtje ardhje në hapësirë për shkak të katastrofës së anijes Kolumbia. Ndërkohë që Diskavëri u hodh në orbitë për misionin e saj 12 ditësh, kamerat kapën imazhe të ciflave duke rënë nga anija. Por nuk është ende e qartë nëse është dëmtuar veshja e jashtme e saj. Zyrtarë të Nasës thanë dje vonë në një konferencë shtypi se një copë pllake mund të ketë rënë gjatë hedhjes. Pllaka janë humbur edhe gjatë hedhjeve të maparshme, por pa shkaktuar ndonjë problem gjatë hyrjes së anijeve në atrmosferën e Tokës. Dhjetëra kamera regjistruan hedhjen e djeshme për të kapur shenja të ciflash të shkëputura, si ato që dëmtuan krahun e anijes Kolimbia gjatë hedhjes dy vjet e gjysmë më parë. Dëmtimi çoi në shpërthimin e anijes Kolumbia gjatë hyrjes në atrmosferën e Tokës, duke shkaktuar vdekjen e 7 astronautëve në bord. Zyrtarët e Nasës thonë se do t’i stdudiojnë me kujdes imazhet për të parë nëse anija ka pësuar ndonjë dëmtim. Presidenti Bush i uroi ekuipazhit të anijes Diskavëri një mision të suksesshëm. Si shumë amerikanë të tjerë, Presidenti Bush ndaloi punën dje në mëngjes për të shikuar televizionin ndërkohë që anija Diskavëri për vajtje ardhje në hapësirë u hodh në orbitë. Zëdhënësi i Shtëpisë së Bardhë, Skot Meklellen, tha se duke shikuar nga një sallon pranë Zyrës Ovale, presidenti duartrokiti hedhjen e suksesshme dhe tha se kjo ishte një ditë e gëzueshme për të gjithë amerikanët: Zoti Maklellen tha se presidenti falenderoi burrat dhe gratë e agjencisë amerikane të hapësirës, të cilët i kanë kushtuar tërë qenien e tyre kthimit të programit të hapësirës në kursin e duhur pas humbjes së ekipazhit të anijes Kolumbia më shumë se dy vjet më parë.",Zyrtarët e Nasës të shqetësuar nga një copë pllake mund të ketë rënë gjatë hedhjes
"Sulmet terroriste të 11 shtatorit ndryshuan Amerikën përgjithmonë, duke pasur një ndikim të thellë në jetën e përditshme, në qeveri dhe në sektorin privat. Dëmi ekonomik nga sulmet ishte i rëndë, madje shuma të mëdha parash të taksapaguesve janë shpenzuar për ta mbajtur Amerikën të sigurtë. Ekspertët thonë se ndërsa një sulm shkatërrimtar si ai i 11 shtatorit 2001 ka pak të ngjarë të ndodh sërish, kërcënimi tani është më kompleks dhe i ndryshëm se në çdo kohë tjetër gjatë dekadës së fundit. Në pjesën e parë të seancave dëgjimore të Kongresit amerikan për të rishqyrtuar përgjigjen ndaj sulmeve, ish kryetari i komisionit të 11 shtatorit Thomas Kean tha se ka të ngjarë të ketë sulme terroriste në të ardhme. tha ai Në dekadën e kaluar, Shtetet e Bashkuara kanë përmirësuar gjerësisht sigurinë nëpër aeroporte dhe porte, dhe kufijtë kombëtarë po ruhen me më shumë agjentë që përdorin teknologjinë e re. Më shumë se 20 agjenci qeveritare të ndryshme përgjegjëse për ndërhyrjen në rast fatkeqësish janë përfshirë në Departamentin e Sigurisë Kombëtare dhe një Qendër Kombëtare Kundër Terrorizmit është krijuar për të mbrojtur, parandaluar dhe ndërprerë aktivitetin terrorist. Adminstrata Obama ka filluar një nismë të madhe për të siguruar materialet bërthamore, një lëvizje për të cilën ish zëvendës kryetarin e Komisonit të 11 shtatorit, Lee Hamilton, tha se duhet të jetë përparësia kryesore e vendit. tha ai Ish udhëheqës të Komisonit për 11 shtatorin thonë se Shtete e Bashkuara janë më të përgatitura për të parandaluar sulme si ato në Pentagon dhe në Qendrën Botërore të Tregtisë në New York, megjithatë ka ende boshllëqe në sigurinë e Amerikës që kërkojnë vëmendje të menjëhershme.",Ish drejtues të një komisioni të krijuar për të shqyrtuar sigurinë kombëtare thonë se vendi ende ka dobësi përballë sulmeve terroriste
"SherilKrouSheril Me një karierë që përfshin 9 çmime Grammy, shumë çmime të muzikës amerikane, 35 milion regjistrime të shitura dhe një fitore personale në luftën me kancerin e gjirit, Sheril e ka treguar veten se sa e vendosur është si në jetën personale edhe atë profesionale. Albumi i saj i ri me titull ""100 Milje nga Memphis"", është i 7-ti dhe i frymëzuar nga kjo distancë midis vendlindjes së saj Kennett në Missouri dhe qytetit Memphis në Tennessee. Turneu më i fundit i Sheril përfshin një bandë me 10 grupe muzikore. Ajo është shumë e kënaqur që në turne ka një grup të ri muzikantësh. Sheril Krou dëshiron të shprehë mirënjohjen e saj për Majkëll Xhekson me albumin e saj të ri. Sheril e përdor famën e saj për të ekspozuar çështje të ndryshme shoqërore e të mjedisit. Më së fundi, ajo kontribuoi në albumin 'Raise Hope for Congo', Programin Botëror të Ushqimit të Kombeve të Bashkuara dhe në programin televiziv 'Stand Up To Cancer' muajin e kaluar. Në aspektin personal, ajo ka rritur dy fëmijë si nënë e vetme, prandaj edhe ngrihet pyetja: Ku gjen ajo kohë për karrierë? Sheril Krou vazhdon turnetë për të reklamuar albumin e saj të ri ""100 Milje nga Memphis"" dhe dashamirët e saj frekuentojnë koncertet. Ajo ka në plan të marrë pushim për festat dhe të kalojë kohë me fëmijët dhe më pas do të vazhdojë turnetë, ashtu siç thotë edhe kënga e vitit 1996, ""If it makes you happy"" nëse kjo të bën të lumtur.","Artistja dha një intervistë për Zërin e Amerikës, ku flet për albumin e saj të ri"
"Takimi i radhës i Këshillit të Stabilizim-Asocimit ndërmjet Kosovës dhe Bashkimit Evropian, përfundoi të hënën në Bruksel, me anulimin e një konference të përbashkët për gazetarë dhe me një komunikatë në të cilën Bashkimi Evropian kritikoi ashpër tarifat e vendosura nga Kosova ndaj mallrave serbe dhe nguli këmbë në heqjen e menjëhershme të tyre. Në një komunikatë të zyrës së shefes së politikës së Jashtme të Bashkimit Evropian, Federica Mogherini, thuhet se vendosja e këtyre tarifave dëmton interesat ekonomike të Kosovës dhe qytetarëve të saj dhe dëmton synimet e Kosovës për të qenë një vend tërheqës për investime. Para takimit të sotëm, zonja Mogherini dhe dy komisionarë të saj, kishin kërkuar nga Kosova që të heqë tarifat dhe si kundërpeshë kishin ofruar vënien e emrit të Kosovës në vend të atij të Misionit të Kombeve të Bashkuara në Marrëveshjen për tregti të lirë në Evropën Qendrore, të njohur si CEFTA. Por, qeveria e Kosovës nuk e ka pranuar një ofertë të tillë. Kryeministri Ramush Haradinaj tha pas takimit se Kosova synon një marrëveshje gjithëpërfshirëse me Serbinë dhe nuk ka kohë për zgjidhje të pjesshme të problemeve siç është çështja e tarifave. Ai tha se ajo duhet të zgjidhet në një marrëveshje që nënkupton njohje, ulëse në OKB dhe anëtarësim në mekanizma ndërkombëtarë për Kosovën. Ai tha se delegacioni i Kosovës ka kërkuar një trajtim të barabartë të saj duke vënë theksin tek liberalizimi i vizave. Ndërsa ka ritheksuar kërkesën që bisedimet për normalizimin e marrëdhënieve me Serbinë të vazhdojnë, por me një rol më të madh të Shteteve të Bashkuara. ""Qeveria dhe unë, asnjëherë, nuk e kemi vënë në pikëpyetje rëndësinë e dialogut. Kjo është e vetmja rrugë përpara për Kosovën dhe Serbinë, që të bëhemi anëtarë të barabartë të familjes evropiane"", thuhet në fjalimin që kryeministri Haradinaj ka mbajtur në takim e të cilin ai e shpërndau në rrjetin social facebook. ""Megjithatë, njëzet vjet pas luftës, dhjetë vjet pas pavarësisë, dhe pesë vjet pas Marrëveshjes së Brukselit, realiteti është se, përparimi drejt normalizimit të marrëdhënieve ndërmjet Kosovës dhe Serbisë ka qenë minimal, dhe në fakt tani ka dalur krejtësisht nga binarët, veçanërisht me diskutimin publik mbi idenë fatale të korrigjimit të kufirit dhe shkëmbimit të territorit; Ka dëmtuar seriozisht kredibilitetin e ndërmjetësuesit, dhe ka dëmtuar arritjet që kemi bërë në dialogun e ndërmjetësuar nga BE për më shumë se 7 vjet"". ""Më lejoni të theksoj edhe një herë, unë si Kryeministër dhe Qeveria e Kosovës, kundërshtojmë fuqishëm dhe e refuzojmë këtë ide, e cila do të sjellë vetëm luftëra dhe tragjedi të reja në Ballkan. Kushdo që flet për kufijtë, territorin, apo çfarëdo korrigjimi tjetër për vendim tim, është armiku ynë"", thuhet mes tjerash në fjalimin e tij. Kosova nënshkroi në vitin 2015 marrëveshjen e Stabilizim Asocimit me Bashkimin Evropian, si kundërshpërblim për angazhimin e saj në bisedimet për normalizimin e marrëdhënieve me Serbinë e cila kundërshton pavarësinë e Kosovës, por hapi bisedimet për anëtarësim për shkak angazhimit në bisedime. Bashkimi Evropian kërkon nga të dyja palët një marrëveshje detyruese, gjithëpërfshirëse për normalizim marrëdhëniesh para së të përmbushin synimin për t'u bërë pjesë e bllokut. Por, bisedimet tashmë kanë ngecur dhe Serbia kushtëzon vazhdimin e tyre me heqjen e tarifave, të cilat qeveria e Kosovës i vendosi më 21 nëntor në shenjë kundërvënieje ndaj siç u tha fushatës agresive të Beogradit ndaj shtetësisë së Kosovës. Parlamenti i Kosovës ngriti të shtunën një ekip negociues dhe miratoi një rezolutë për bisedimet e cila hedh poshtë mundësinë e diskutimit të tërësisë tokësore të Kosovës. Vendimi i cili nuk pati konsensus, nxiti reagimin e Beogradit i cili tha se ky është një veprim që i mbyllë dyert e bisedimeve.","Zyrtarë të BE-së anuluan një konferencë të përbashkët me kryeministrin e Kosovës, Ramush Haradinaj për shkak të mospajtimeve rreth tarifave të Kosovës ndaj mallrave serbe, por edhe procesit të bisedimeve Kosovë - Serbi."
"Në Kinë është krijuar një grup milionerësh dhe miliarderësh të fuqishëm që kur vendi u hap për ekonominë e tregut. Në këtë grup dallojnë të ashtu-quajturit ‘princat e vegjël’, një term që përfshin fëmijët e funksionarëve të lartë të partisë. Në vazhdim i hedhim një vështrim kësaj klase fisnikësh pa tituj: Me ceremoni madhështore u organizuar Kongresi i Partisë Komuniste për të zgjedhur brezin e udhëheqësve të rinj. Shumë prej tyre janë bijtë e ish-funksionarëve të lartë të partisë. Ata njihen me termin ‘princat e rinj’ pasi kanë arritur status politik, kryesisht falë lidhjeve familjare. Në shumë raste, shpjegon gazetari Hu Ping përmes lidhjes me Skype, shumë prej tyre grumbullojnë edhe pasuri në procesin e ngritjes politike: “ Një artikull i fundit i New York Times thotë se të afërmit e Wen Jiabaos kanë grumbulluar më shumë se 2.7 miliardë dollarë gjatë periudhës që ai ka qenë kryeministër. Pasuria është e fshehur në bono, investime financiare, aksione në kompani komunikacioni, apo pika pushimi. Zëdhënësi i Ministrisë së Punëve të Jashtme në Kinë Hong Lei shprehet se artikulli bën shpifjenëtarë të tjerë të Komitetit të Byrosë Politike kanë pjesëtarë të familjes me lidhje të forta me biznesin. Dhëndri i Kryetarit aktual të Partisë Komuniste, Hu Jintao, ishte më parë Shefi Financiar i Sina.com, faqja më e madhe elektronike në Kinë. Në vitin 2003 llogaritej që ai të kishte nga 35-60 milionë dollarë. Djali i anëtarit të Komitetit të Byrosë Politike Li Changchun është drejtues i lartë i kompanisë shtetërore China Mobile, një gjigand në telekomunikacion. Në fillim të vitit, grupi mediatik Bloomberg News njoftoi se motra dhe të afërm të tjerë të Presidentit të ri kinez Xi Jinping kanë më shumë se 100 milionë dollarë si pasuri familjare. E gjithë kjo pasuri është grumbulluar ndërkohë që Partia vazhdon të këmbëngulë se përfaqëson interesat bazë të klasës punëtore dhe kryeministri Wen Jiabao zotohej të godiste korrupsionin. Bo Xilai, djali i një funksionari të lartë të partisë, pritej të bëhej anëtar i Komitetit Qendror të Byrosë Politike, pas ndryshimeve në udhëheqje. Por ai u përjashtua nga partia nën akuzat për korrupsion, pasi bashkëshortja e tij u shpall fajtore për vrasjen e një biznesmeni britanik lidhur me një mosmarrëveshje për biznesin.",Bijtë dhe të afërmit e funksionarëve të lartë të partisë në Kinë kanë grumbulluar pasuri marramendëse
"Nëse demokratët marrin kontrollin e Dhomës së Përfaqësuesve më 7 nëntor, një ligjvënëse demokrate nga Kalifornia mund të bëhet gruaja e parë kryetare e kësaj dhome. Nancy Pelosi u bë kryetare e demokratëve të Dhomës së Përfaqësuesve në vitin 2002 pas dy dekadash si anëtare e Kongresit. Ndodhi menjëherë pasi demokratët kishin pësuar humbje shkurajuese ndaj republikanëve në zgjedhjet për Kongresin. Zonja Pelosi tha se partia e saj duhet të krijonte një kontrast të qartë me politikat e Presidentit Bush dhe republikanëve. Katër vjet më pas, 66 vjeçarja, nënë e pesë fëmijëve është gati të bëhet e para grua kryetare e Dhomës së Përfaqësuesve, nëse demokratët marrin shumicën në zgjedhjet e së martës. Votat e zonjës Pelosi janë pasqyrim i elektoratit te saj liberal në San Francisco. Ajo ka qenë aktive në drejtim të të drejtave të njeriut, planifikimin familjar dhe çështjet e mjedisit dhe votoi kundër shkurtimit të taksave të propozuar nga Presidenti Bush. Ajo e kundërshtoi që në fillim luftën kundër Irakut dhe kundërshtoi programin e Presidentit Bush për përgjimin elektronik si masë kundër terrorizmit. Ky qëndrim e ka kthyer atë në një nga objektivat e parë të sulmeve të kandidatëve republikanë, Presidentit Bush dhe zyrtareve të tjerë në administratën e tij. Këshilltari kryesor politik i Presidentit, Karl Rove dhe të tjerë i përsërisin këto akuza thuajse çdo ditë. Edhe disa demokratë shqetësohen se sulmet republikane që e paraqesin zonjën Pelosi si nje personalitet jo te forte për sigurinë kombëtare dhe terrorizmin dhe në favor të ngritjes së taksave do t’i dëmtojë shanset e demokratëve. Zonja Pelosi duket se fiton energji nga sulme të tilla, duke iu përgjigjur në këtë mënyrë pohimeve të presidentit dhe republikanëve se një fitore demokratike do të thoshte humbje në Irak dhe në luftën kundër terrorizmit. Kritikët kanë thënë se nëse demokratët marrin kontrollin e Dhomës së Përfaqësuesve, do të fillonte një periudhë hakmarrjesh kundër republikanëve që e mbajne pushtetin që nga viti 1994. Por zonja Pelosi e kundërshton këtë qëndrim. Ajo përjashton, për shembull, mundësinë e ndonjë përpjekjeje demokrate për ta akuzuar Presidentin Bush mbi mungesen e informacioneve te zbulimit para luftës së Irakut. Nëse demokratët fitojnë kontrollin e Dhomës së Përfaqësuesve të martën, zonja Pelosi thotë se rezultati do të ishte një referendum për vetë republikanët. Ajo zotohet se do t’i përdorte 100 ditët e para si Kryetare e Dhomës së Përfaqësuesve për të vënë në zbatim të gjitha rekomandimet e komisionit të 11 shtatorit që hetoi sulmet terroriste të vitit 2001, për ngritjen e rrogës minimale dhe për të krijuar kushtet për kthimin e trupave amerikane në vitin 2007. Përsa u takon ndryshimeve thelbësore që mund të ndodhin nëse demokratët fitojnë pushtetin në Kongres, zonja Pelosi thotë se ata do te sillnin integritet dhe ndershmëri në qeveri. Ndërkohë, republikanët po bëjnë të gjitha përpjekjet që t’u kundervihen anketave që tregojnë se Pelosi dhe demokratët janë të preferuar pak ditë para se amerikanët të shkojnë në kutitë e votimit.",Nancy Pelosi do të ishte gruaja e parë që zgjidhet në këtë post në Shtetet e Bashkuara
"Rreziku nga pastrimi i parave dhe financimi i aktiviteteve terroriste mbetet i lartë në Shqipëri. Në këtë përfundim arrin Këshilli i Evropës në raportin e tij të fundit mbi masat që ka marrë vendi për të luftuar pastrimin e parave dhe financimin e aktiviteteve terroriste. Raporti pohon se Shqipëria ka bërë përparim të konsiderueshëm, duke vlerësuar se ekziston konceptimi i duhur i problemit të pastrimit të parave dhe rrezikut që përbëjnë burimet e paligjshme financiare dhe pastrimi i tyre në ekonominë formale. Por raporti thekson se nevojitet një analizë më e hollësishme mbi kërcënimet që shoqërohen me financimin e grupeve dhe aktiviteteve terroriste si dhe një sistem më funksional në ndjekjen e pasurive të krijuara në forma të paligjshme dhe pistave për pastrimin e tyre. Raporti nënvizon se rreziku kryesor në vend për pastrimin e parave vjen nga korrupsioni, sidomos duke pasur parasysh lidhjet në shumë raste të zyrtarëve të korruptuar me krimin e organizuar që gjenerojnë shuma të mëdha parash dhe minojnë funksionimin efektiv të sistemit të drejtësisë. Megjithëse autoritetet janë të vetëdijshme për problemin, aktiviteti i forcave të rendit për të goditur këto fonde dhe përpjekjet për pastrimin e tyre ka qenë shumë i kufizuar, thuhet në raport. Hetimet, thuhet më tej, në një përqindje të vogël të rasteve çojnë në ngritje akuzash dhe kjo përqindje është drejt rënies. Në shumë raste proceset hetimore pezullohen, ose akuzat braktisen nga prokurorët. Këshilli i Evropës në raportin e tij thekson se Shqipëria ka bazën ligjore të nevojshme për konfiskimin e pasurive të vëna me aktivitet të paligjshëm. Por statistikat mbi pasuritë e konfiskuara nuk duken në përputhje me nivelin e aktivitetit kriminal në vend. Këshilli i Evropës nënvizon se Shqipëria është zyrtarisht e hapur për bashkëpunim ligjor me vende të tjera në rastet e hetimeve nën dyshime për korrupsion, apo pastrim parash, por shton se mekanizmat ligjore në operim janë shumë të ndërlikuara dhe përfshijnë autoritete të shumta me afate të ndryshme kohore për kërkesa e ekzekutim, duke konkluduar se këto hallka pengojnë një proces hetimor efiçent. Në Shqipëri në kohën e analizës, thuhet në raport, nuk kishte një sistem që trajton me përparësi kërkesat nga vende të tjera për hetimin e rasteve të pastrimit të parave. Këshilli i Evropës vëren se megjithë masat e fundit për të zgjeruar raportimin e rasteve të lëvizjes së parave jashtë vendit nga Banka e Shqipërisë, ndjekja e aktivitetit që dyshohet si pastrim parash apo financim i organizatave terroriste është shumë i kufizuar. Raporti vë në dukje se Analiza për Nivelin e Rrezikut në Shqipëri ka identifikuar një rritje të kërcënimit nga radikalizmi fetar dhe nga përpjekjet për rekrutim për aktivitet terrorist. Megjithatë, sipas analizës së Këshillit të Evropës, Shqipëria nuk duket e përgatitur për t’iu përgjigjur me masat e nevojshme këtij rreziku. Autoritetet nuk kanë krijuar një metodologji sistematike për të identifikuar dhe hetuar rastet e financimit të grupeve terroriste. Megjithëse ka pasur ndjekje penale për persona që kanë shkuar për të luftuar në Siri, nuk ka pasur akuza të ngritura apo ndëshkime për financimin e aktiviteteve terroriste. -Një analizë të gjerë dhe të kujdesshme të rreziqeve nga pastrimi i parave apo financimi i aktiviteteve terroriste, ndërgjegjësim për lidhjen dhe ndikimin që kanë ekonomia informale dhe korrupsioni tek tendenca për pastrim parash dhe financimi i aktivitetit terrorist; analizimi i rrezikut nga organizata apo entitete si grupet e krimit të organizuar. -Të koordinohen politikat në nivel kombëtar për t’iu përgjigjur rreziqeve komplekse nga pastrimi i parave/financimi i aktiviteteve terroriste, të cilat nuk po adresohen me strategjitë ekzistuese. -Të analizohen arsyet për nivelin e ulët të proçedimit të rasteve për pastrim parash si dhe të mangësive në proceset hetimore, që u identifikuan në Analizën mbi Nivelin e Rrezikut. -Angazhim aktiv për të ndjekur penalisht raste të pastrimit të parave, përfshirë rastet kur ka fonde që kalojnë kufijtë shtetërorë, duke shfrytëzuar më mirë provat rrethanore në aktet e dyshuara kriminale, qofshin edhe të mbledhura jashtë vendit, në raste kur ka prova të tilla. -Masa për të identifikuar fondet dhe përfitimet e siguruara përmes aktivitetit kriminal si brenda edhe jashtë vendit dhe të ndërmerren hapa për t’i konfiskuar pasuritë e krijuara me këto fonde.","Këshilli i Evropës, në raportin e tij mbi luftën kundër pastrimit të parave dhe financimit të aktivitit terrorist, thotë se Shqipëria nuk po bën sa duhet për të ndjekur penalisht autorët e këtyre veprave."
"Presidenti i Kosovës, Hashim Thaçi, shkroi në rrjetin facebook se “Kosova është gati të shqyrtojë heqjen e taksës për prodhimet serbe nëse Kosovës i jepet një rrugë e qartë drejt arritjes së një marrëveshjeje përfundimtare paqësore me Serbinë”. Ai i bëri jehonë deklaratës së tij për “The Washington Post”, ku ka kërkuar që Shtetet e Bashkuara të marrin një rol udhëheqës në bashkërendimin e përfshirjes ndërkombëtarë për “marrëveshjen paqësore finale që do të sjellë njohjen e Kosovës nga Serbia. Ndërgjegjja jonë na kërkon – dhe është detyrë e jona historike – që të bëjmë paqen të mundshme dhe të vërtetë”, shkroi ai. Gazeta amerikane shkroi se presidenti Thaçi, më 21 dhjetor kishte zhvilluar një takim të pa raportuar diplomatik në Berlin me ambasadorin amerikan, Richard Grenell, në të cilin ishte zotuar për heqjen e tarifave prej 100 për qind ndaj mallrave serbe. Gazetar citon ambasadorin Grenell të ketë thënë se “presidenti Thaçi dhe unë folëm për rëndësinë e marrjes së vendimeve afatgjate në vend të veprimeve afatshkurtra. Isha i kënaqur që ai u pajtua dhe do të angazhohet për heqjen e tarifave të vendosura së fundmi mbi prodhimet serbe. Kjo lëvizje do të ndihmonte që të dërgoheshin shenjat e duhura se ai është serioz për negociatat dhe në ndërtimin e besimin ndërmjet palëve”. Takimi në Berlin kishte ndodhur pak ditë pasi që presidenti amerikan Donald Trump, u dërgoi letra presidentit Thaçi dhe presidentit të Serbisë, Aleksandër Vuçiç, duke u bërë thirrje të dyja palëve “që të shfrytëzojnë kohën e duhur për të arritur një marrëveshje pajtimi ndërmjet tyre”, marrëveshje që siç thuhet, “do të pasqyronte në mënyrë të drejtpeshuar interesat e të dyja palëve”. Më 21 nëntor të vitit që lamë pas, qeveria e Kosovës vendosi tarifa prej 100 për qind për mallrat nga Serbia, në shenjë kundërshtimi ndaj siç u tha, fushatës agresive të Beogradit ndaj shtetësisë së Kosovës. Tarifat nxitën reagimin e Bashkimit Evropian që kërkoi anulimin e tyre por edhe të Shteteve të Bashkuara. Beogradi tha se nuk do të ketë vazhdim bisedimesh nëse nuk anulohet tarifa. Nuk pati një reagim të menjëhershëm të qeverisë së Kosovës ndaj deklaratave të presidentit Thaçi, por deri tash kryeministri Ramush Haradinaj ka theksuar se çështja e tarifave do të jetë pjesë e marrëveshjes për njohjen e ndërsjellë në mes të Kosovës dhe Serbisë. Zyrtarë të qeverisë, thanë në rrjetet sociale se tarifa nuk mund të hiqet nga presidenti dhe ajo nuk është vënë për t’u hequr pa u përmbushur kushtet për një gjë të tillë. Me gjithë tensionet, autoritetet në Kosovë thonë se janë të gatshme të vazhdojnë bisedimet për normalizimin e marrëdhënieve me Serbinë dhe një ekip negociator i miratuar më 15 dhjetor në parlamentin e Kosovës, pa pajtimin e partive me të mëdha opozitare, do të qëndrojë të martën në Bruksel për të takuar zyrtarët e lartë të Bashkimit Evropian.","Presidenti i Kosovës, Hashim Thaçi, la të hapur mundësinë për anulimin e tarifave ndaj mallrave serbe, për t’i hapur rrugën procesit të bisedimeve me Serbinë."
