text,summary
"Presidenti i Kosovës, Hashim Thaçi, tha të hënën në Prishtinë se është e pa drejtë dhe e pa pranueshme që 20 vjet pas luftës, barra e fajësisë për përdhunimet gjatë saj të vazhdojë të bjerë mbi të mbijetuarit e kësaj dhune, dhe jo mbi kryerësit e saj. Ai i bëri këto komente gjatë një konference të organizuar nga Bashkësia Islame e Kosovës, me moton “Të gjithë së bashku me një zë”, që mblodhi për herë të parë përfaqësuesit e bashkësive fetare përveç Kishës Ortodokse Serbe, në mbështetje të të mbijetuarve të përdhunimeve gjatë luftës. “”, tha zoti Thaçi. Kryetari i Bashkësisë Islame të Kosovës, myftiu Naim Tërnava, tha se shoqëria është vonuar shumë në trajtimin e duhur të të mbijetuarve të përdhunimeve gjatë luftës. “”, tha ai. Ai bëri thirrje që të gjithë duke filluar nga familja, e deri te institucionet shtetërore t’i nderojnë e mbështesin viktimat e këtij krimi. ""”, tha zoti Tërrnava. Përfaqësuesi i Kishës Katolike, Dom Lush Gjergji, tha se të mbijetuarit e përdhunimeve gjatë luftës nuk duhet të heshtin, por as rrethi i tyre nuk duhet të heshtë siç ka bërë deri tash. “”, tha ai. Ende nuk dihet numri i saktë, por besohet se mijëra ishin viktima të përdhunimeve nga forcat serbe gjatë luftës në Kosovë. Thuhet se numri i tyre mund të jetë rreth 20 mijë, por numri i saktë mbase nuk do të mësohet kurrë dhe rrëfimet rreth tyre deri vonë ishin shumë të pakta për shkak të frikës nga stigmatizimi. Deri tash askush nuk është dënuar për këtë krim, ndonëse është i dënueshëm me ligjet vendase e ndërkombëtare.","Në Prishtinë, udhëheqës institucionesh shtetërore dhe të bashkësive fetare, kërkuan mbështetje dhe drejtësi për viktimat e përdhunimeve gjatë luftës."
"Një nga senatorët që kanë shprehur shqetësim të veçantë për gjendjen e pakicës serbe në Kosovë është George Voinovich. Në një intervistë që i dha Zërit të Amerikës, senatori tha se në procesin e bisedimeve për statusin, prania e KFOR-it do të ketë rëndësi të veçantë për garantimin e sigurisë: ""Mendoj se ka rëndësi që të dyja palëve t’u ofrohen stimuj të fuqishëm që ato të arrijnë një farë kompromisi, tha senatori Voinovich. Ka gjithashtu rëndësi të jashtëzakonshme që Shtetet e Bashkuara të kenë praninë e tyre në tryezën e bisedimeve. Në këto kushte, prania e KFOR-it është më e rëndësishme se asnjëherë më parë në mënyrë që udhëheqësit serbë, të cilëve do t’u kërkohet të bëjnë disa lëshime, të mund t’i garantojnë popullit serb se manastiret dhe objektet e trashëgimisë historike si dhe të drejtat e pakicave në Kosovë do të mbrohen pasi në Kosovë ekziston kjo forcë ushtarake. Kjo gjithashtu do t’u dërgonte një sinjal atyre njerëzve që mendojnë se mund t’i realizojnë qëllimet e tyre me anë të imponimit dhe pa u ndëshkuar."" ""Veç kësaj, tha senatori Voinovich, mendoj se ka rëndësi që Serbisë dhe Malit të Zi t’i ofrohen disa stimuj ekonomikë, siç janë perspektiva që ato të bëhen pjesë e Bashkimit Evropian dhe e Natos në të ardhmen, gjë që do të përmirësonte nivelin e tyre të jetesës. Po kështu edhe për kosovarët, në mënyrë që njerëzit e moderuar në Kosovë të mund t’u thonë vëllezërve dhe motrave të tyre se çështja e statusit do të zgjidhet, ndoshta jo pavarësi tani, por do të ecet drejt këtij objektivi dhe kjo do të përmirësonte standartin e jetesës. Megjithatë do të ishte naive të mendohej se kjo do të jetë e lehtë,"" tha senatori Voinovich. Ndërsa anëtari i Dhomës së Përfaqësuesve, George Radanovich thotë se rruga drejt përcaktimit të statusit do të jetë e vështirë. ""Mendoj se në çështjen e statusit të Kosovës duhet ecur me shumë kujdes. Në rast se do të kërkohet të krijohet një shtet i pavarur i Kosovës pa rrezikuar sigurinë e asnjërit, përfshirë sigurinë e pakicës serbe, kjo mendoj se do të jetë e vështirë. Komuniteti ndërkombëtar duhet të garantojë se çdo vetvendosje për Kosovën nuk do të shkaktojë trazira dhe nuk do të çojë në vdekjen e qytetarëve të pafajshëm."" Zoti Radanovich thotë se alternativat për sa i përket statusit të Kosovës janë pavarësi në aspektin afatgjatë ose pavarësi nën mbikqyrjen e OKB-së për një kohë të gjatë. Megjithëse ata qysh tani e kanë sistemin e tyre të qeverisjes dhe një forcë policore, mendoj se një prani e OKB-së për një farë kohe gjatë pavarësisë do të garantonte mbrojtjen e jetës së qytetarëve të pafajshëm.",Deputetët shprehen se çdo zgjidhje e statusit duhet të përfshijë garanci për mbrojtjen e të drejtave të pakicave dhe të objekteve të ty
"Ambasadori i delegacionit të Bashkimit Europian në Tiranë, Helmut Lohan i dorëzoi Kryeministrit Sali Berisha pyetësorin mbi bazën e të cilit Komisioni Europian do të përgatisë opinionin mbi kërkesën e Shqipërisë për anëtarësim në BE dhe bëri thirrje për kapërcimin e ngërçit të tanishëm politik në vend. Zoti Lohan tha se pyetësori është një një hap i ri historik në marrëdhëniet Shqipëri-BE. Fjala është për mbi 2 mijë pyetje të përfshira në 384 faqe përmes të cilave autoriteteve shqiptare do t’i kërkohet shpjegim për ecurinë e vendit në të gjitha fushat dhe përputhshmërinë me kriteret e anëtarësimit. Zoti Lohan tha se pyetësori është tregues i seriozitetit me të cilin Bashkimi Europian përpiqet të mbledhë informacionin. Ai tha se Komisioni Europian do t'i analizojë përgjigjet me kujdes të madh dhe do të bëjë vlerësimin e ecurisë në të gjitha fushat, pëfshirë sundimin e ligjit, luftën kundër korrupsionit dhe krimit të organizuar. Ambasadori i BE-së bëri thirrje që reformat për intergrimin në BE duhet të bazohen mbi një konsensus sa më të gjerë. Në një referencë të qartë për mungesën e opozitës në kuvend, zoti Lohan theksoi se vendi për debat politik është brenda parlamentit. Ai tha se Bashkimi Europian u bën thirrje të gjitha partive politike të ndjekin dialogun kontruktiv, duke përfshirë atë në parlament dhe uroi që ngërçi politik të kapërcehet brenda këtij viti ose në fillim të vitit të ardhshëm. Më 16 nëntor Këshilli i Ministrave të BE miratoi kërkesën e Shqipërisë, e cila ishte dorëzuar që në fund të muajit prill. Autoritetet shqiptare kanë deklaruar prej kohësh se ata kanë kryer të gjitha përgatitjet për të nisur menjëherë nga puna me pyetësorin. Kjo fazë e procesit zgjat përgjithësisht deri në 18 muaj, por qeveria shqiptare ka deklaruar se shpreson ta përmbyllë dhe të marrë statusin e vendit kandidat brenda vitit të ardhshëm. //ii",Ambasadori i BE-së në Shqipëri bëri thirrje që reformat për intergrimin në BE të bazohen mbi një konsensus të gjerë dhe theksoi se vend
"Në Hungari, ekipet e shpëtimit vazhdojnë punën për të pastruar rrjedhjen toksike që shkaktoi vdekjen e të paktën katër personave dhe lëndimin e 120 të tjerëve. Zyrtarët thanë sot se po pastrojnë rrugët dhe shtëpitë një ditë pas rrjedhjes toksike nga një uzinë alumini. Autoritetet thanë se gati 700 mijë metra kub mbjetje vërshuan në tre fshatra në afërsi të qytetit Devesher pas çarjes së një rezervuari. Tre persona ende figurojnë të zhdukur. Bashkimi Evropian shprehu shqetësim se mbetja toksike që rrodhi në Hungari mund të shndërrohet në një katastrofë ekologjike në vende të tjera. Zëdhënësi i Komisionit Evropian për Mjedisin Joe Hennon tha sot se Bashkimi Evropian po qëndron i gatshëm të ndihmojë në se katastrofa merr përmasa më të mëdha. Me Danubin pranë që përshkon Kroacinë, Serbinë, Rumaninë, Bullgarinë, Ukrainën dhe Moldavinë para se të derdhet në Detin e Zi, ekziston mundësia që mjedisit t’i shkaktohet një dëm serioz. thotë zëdhënësi i Komisionit Evropian për mjedisin Joe Hennon. Qindra njerëz u evakuuan pas katastrofës e cila ndodhi të hënën, kur një rezervuar gjigand shpërtheu në uzinën metalike në Ajka, qytet rreth 160 kilometra në jugperëndim të Budapestit. Autoritetet hungareze kanë shpallur gjendjen e jashtëzakonshme, duke e quajtur derdhjen një katastrofë ekologjike që mund të kërcënojë Danubin.",Bashkimi Evropian shprehu shqetësim se mbetja toksike mund të shndërrohet në një katastrofë ekologjike në vende të tjera
"Nën një diell verbues, Presidenti Bush dhe Presidenti Hu kaluan në revistë truprorjen e nderit në pjesën jugore të oborrit të Shtëpisë së Bardhë. Ceremonia ishte pjesë e protokollit të pritjeve zyrtare dhe kjo ishte vizita e parë zyrtare e Presidentit Hu në Uashington. Tregëtia ishte në krye të rendit të ditës së bisedimeve. Volumi tregëtar mes dy vendeve arrin në 285 miliardë dollarë në vit, por hendeku tregëtar po thellohet, duke kapur shifrën 202 miliardë dollarë në favor të Kinës. Duke theksuar se dy vendet janë të angazhuara për të zgjeruar tregëtinë, Presidenti Bush thotë se tregëtia mes tyre duhet të jetë e balancuar më mirë. “Marrëdhëniet tona tregëtare mund të bëhen më të forta, ndërsa Kina miraton ligje që do të lejonin firmat amerikane të konkurrojnë në Kinë me të njejtën lehtësi që firmat kineze konkurojnë këtu në Shtetet e Bashkuara”. Presidenti Bush thotë se tregëtia e lirë është pjesë e statusit të Kinës si anëtare e përgjegjshme e sistemit ekonomik botëror dhe një vend kryesor në tregëtinë botërore. Duke folur përmes një përkthyesi, Presidenti Hu tha se do të vazhdojë përpjekjet për reformimin e sistemit të këmbimit të monedhës kineze për të hapur më tej tregjet kineze, për të shtuar importet dhe për të forcuar ligjet për të drejtat e autorit. “Ne do të vazhdojmë të ndjekim strategjinë e shtimit të kërkesës së brendshme për të patur zhvillim ekonomik dhe social të balancuar dhe të shpejtë. Kjo do të shtojë mundësitë për thellimin e bashkëpunimit ekonomik midis Kinës dhe Shteteve të Bashkuara”. Presidenti Hu tha se është gati të çojë përpara dialogun bazuar në parimin e respektit reciprok dhe barazisë për të përmirësuar “kauzën botërore për të drejtat të njeriut”. Gjendja e të drejtave të njeriut në Kinë ka qënë vazhdimisht burim përplasjesh midis dy vendeve dhe Presidenti Bush ka bërë thirrje për liri më të mëdha individuale. Me shtimin e marrëdhënieve mes dy vendeve, presidenti Bush tha se udhëheqësit e tyre mund të jenë të hapur rreth mosmarrëveshjeve dhe se ai do të vazhdojë të këmbëngulë në çështjen e të drejtave të njeriut. Komentet e Presidetit Hu në mjediset e Shtëpisë së Bardhë u ndërprenë për pak kohë nga një protestues që thërriste me zë të lartë se ditët e Presidentit Hu janë të numëruara dhe që i kërkonte Presidentit Bush t’i kërkonte homologut kinez të merrte masa që anëtarët e lëvizjes shpirtërore Falun Gong të mos ndiqen nga autoritetet. Presidenti Bush, me një pamje disi të shqetësuar në fytyrë nga protestuesja, i tha presidentit Hu të vazhdonte fjalimin. Më pas protestuesja u largua nga autoritetet. Jashtë Shtëpisë së Bardhë ndërkohë vazhdonin protesta të ngjashme. Anëtarja e lëvizjes Falun Gong, Chi Hwan, tha se dëshironte që Presidenti Bush ta ngrinte këtë çështje me udhëheqësin kinez. “Shpresoj që Presidenti Bush ta përmendë këtë çështje, ndjekjen që u bëhet anëtarëve të kësaj lëvizjeje në Kinë, dhe t’i kërkojë zotit Hu t’i japë fund kësaj praktike. Kjo është një çështje shumë serioze”. Nga ana tjetër e rrugës, përkrahës të Partisë Komuniste të Kinës kishin organizuar një koncert me valle tradicionale kineze dhe përshëndesnin vizitën e Presidentit Hu. Një prej tyre thotë se administrata e Presidentit Hu ka arritur përparime të mëdha duke përmirësuar jetën e popullit kinez. “Ne jemi të kënaqur me atë që ka bërë qeveria kineze për të përmirësuar rritjen ekonomike dhe për të përmirësuar marrëdhëniet me vendet e tjera të botës.” Presidenti Bush tha se ai e vlerëson rolin e Kinës për organizimin e bisedimeve 6-palëshe që synojnë të bindin Korenë e Veriut të heqë dorë nga programi i saj bërthamor. Në bisedime, ku marrin pjesë Shtetet e Bashkuara, Kina, Japonia, Rusia, Koreja e Jugut, Koreja e Veriut është arritur pak pëparim. Presidenti Bush i bëri thirrje udhëheqësit kinez të përdorë ndikimin e tij tek Pheniani drejt synimit për të patur një gadishull korean pa armë bërthamore. //az//","Një grup i madh protestuesish, të mbledhur para Shtëpisë së Bardhë, demonstrojnë kundër gjendjes së të drejtave të njeriut në Kinë"
"Partitë opozitare në Kosovë, vendosën të martën tenda në qendër të Prishtinës, përballë qeverisë, për të hapur një periudhë të re protestash. Kryetari i lëvizjes Vetëvendosje, Visa Ymeri, tha se ""”. Udhëheqësit e partive opozitare thanë se kanë marrë leje për vendosjen e tendave nga komuna e Prishtinës, kryetar i së cilës është Shpend Ahmeti nga lëvizja Vetëvendosje. ""”, tha Ramush Haradinaj, kryetar i Aleancës për Ardhmërinë e Kosovës. Kryetari i Nismës për Kosovën, Fatmir Limaj, u bëri thirrje qytetarëve për një protestë paqësore. """", tha zoti Limaj. Që nga shtatori i vitit të kaluar, opozita ka bllokuar punën e parlamentit duke kundërshtuar marrëveshjen për asociacionin e komunave me shumicë serbe sikurse edhe atë të arritur me Malin e Zi për shënimin e kufirit. Qeveria e Kosovës u bëri sërish ftesë partive opozitare që çdo shqetësim të tyre ta diskutojnë në parlamentin e Kosovës. Por, partitë opozitare thonë se qeveria duhet të largohet në dritën e vlerësimeve të Gjykatës Kushtetuese mbi marrëveshjen e arritur me Serbinë për asociacionin e komunave me shumicë serbe në Kosovë. Në dhjetor të vitit të kaluar Gjykata tha se marrëveshja në pjesën më të madhe të saj nuk është në përputhje me Kushtetutën e Kosovës. Opozita i dha këtë javë qeverisë afat që deri më 27 shkurt që të largohet për t’u hapur rrugën zgjedhjeve të parakohshme. Po ashtu, partitë opozitare kanë paralajmëruar forma të ndryshme të kundërshtimit të zgjedhjes së presidentit të ri të Kosovës, që sipas Kushtetutës duhet të përmbyllet deri më 7 mars. Opozita është shprehur kundër mundësisë që kryetari i Partisë Demokratike Hashim Thaçi të jetë president i ri që do të pasojë presidenten aktuale Atifete Jahjaga, mandati i së cilës skadon më 7 prill.",Partitë opozitare thanë se nga e marta do të fillojnë protestat e vazhdueshme përballë qeverisë së Kosovës.
"Të hënën një gjykatë në Rusi dënoi udhëheqësin e opozitës dhe blogerin e anti-korrupsionit, Alexei Navalny me pesëmbëdhjetë ditë burg për rezistencë ndaj policisë dhe me një gjobë prej 20.000 rublash, rreth 350 dollarë amerikanë, për organizim të protestave masive në Moskë. Alexei Navalny i hodhi poshtë pretendimet zyrtare se protesta e mbajtur të dielën pasdite, ishte e paligjshme. zoti Navalny citohet nga agjencia shtetërore ruse e lajmeve TASS të ketë thënë në gjykatë. Zëdhënësi i Kremlinit, Dmitry Peskov, të hënën tha se autoritetet e Moskës ofruan dy vende alternative për organizatorët, sipas agjencisë së lajmeve Interfax. tha ai. Zoti Peskov i quajti protestuesit provokatorë, në kërkim të nxitjes së dhunës dhe akuzoi organizatorët se kanë shfrytëzuar fëmijët, duke pretenduar se shumë prej tyre janë paguar për të marrë pjesë në protestë. Ai nuk tha prova për këtë pretendim. Avokati i zoti Navalny tha se do ta apelojë vendimin. Organizatorët thanë se të dielën u mbajtën demonstrata kundër korrupsionit në më shumë se 80 qytete në të gjithë Rusinë. Ato ishin protestat më të mëdha anti-qeveritare pa leje në Rusi që nga protestat masive të viti 2011-2012 kundër manipulimit të zgjedhjeve dhe kthimit të Vladimir Putinit në presidencë. Protesta u zhvillua në 17-vjetorin zgjedhjes së Vladimir Putinit për herë të parë si president i vendit. Qindra protestues paqësorë u ndaluan në Moskë, disa brutalisht u tërohoqën zvarrë në tokë vetëm për shkak se po mbanin parulla që kritikonin autoritetet dhe korrupsionin. Alexei Navalny u arrestua pasi mbërriti në protestën që po mbahej në rrugën Tverskaya pranë Sheshit Pushkin në qendër të Moskës. Disa vëzhgues dhe gazetarë gjithashtu thuhet se u ndaluan. Uashingtoni ka ""dënuar ashpër"" arrestimin e protestuesve, përfshirë Alexei Navalny-in. tha përmes një deklarate zëdhënësi i Departamentit të Shtetit, Mark Toner. Ai tha se së Shtetet e Bashkuara janë të ""tronditura"" nga arrestimi i zotit Navalny, i cili ka njoftuar planet për të kandiduar për president në zgjedhjet e vitit 2018. Zëdhënësi i Shtëpisë së Bardhë Sean Spicer tha se populli rus meriton një qeveri që mbështet një Ngjarja e së dielës tha Boris Kagarlitsky, drejtor i Institutit për Studime të Globalizimit dhe Lëvizjeve Sociale. Një numër i madh protestuesish ishin të rinjë rusë, studentë universiteti. Disa analistë thonë se kjo mund të jetë një tregues se Kremlini dhe elita politike është duke humbur lidhjen me brezin e ri. tha Mikhail Chernysh, zëvendës drejtor i Institutit të Sociologjisë. Protestat u nxitën nga hetimi që po zhvillonte udhëheqësi i opozitës, Alexei Navalny mbi dyshimet për korrupsion nga kryeministri Dmitry Medvedev. Fondi për Luftimin e Korrupsionit, një organizatë që drejtohet nga zoti Navalny, publikoi rezultatet e hetimit në një video në YouTube ku tregohen prona që mendohet se zotërohen nga kryeministri Medvedev. Videoja ka marrë mbi 11 milionë klikime. Në gjykatë të hënën, zoti Navalny kërkoi që kryeministri Medvedev të merrej në pyetje. Medvedev ende nuk ka bërë komente për këto akuza. thotë zoti Kagarlitsky. Alexei Navalny të hënën u tha gazetarëve në gjykatë se përsëri do t’u bëjë thirrje njerëzve të protestojnë, duke thënë se autoritetet mund të ndalojnë mijëra, por jo dhjetëra mijëra apo miliona njerëz.","Sipas analistëve, protesta e së dielës është një tregues se rusët janë të lodhur nga korrupsioni dhe problemet e tjera politike dhe sociale"
"Në Shqipëri, nisi sot seanca në Gjykatën e Apelit për Krimet e Rënda, për masën e sigurisë ndaj ish ministrit të Brendshëm Saimir Tahiri, ndaj të cilit dy javë më parë, Gjykata e Shkallës së parë kishte konfirmuar mësën e arrestit në shtëpi. Ndaj zotit Tahiri Prokuroria ka ngritur akuzën për “Trafikim të narkotikëve, në bashkëpunim, në formën e grupit të strukturuar kriminal”, dhe “Korrupsion pasiv i funksionarëve të lartë shtetërorë”. Seanca e sotme vjen pas ankimit të bërë si nga zoti Tahiri ashtu dhe nga Prokuroria. Ish ministri i Brendshëm, kërkon që t’i hiqet arresti në shtëpi pasi siç u shpreh pas vendimit të mëparshëm avokati i tij mbrojtës Maksim Haxhia “ ish ministri gjatë gjithë kësaj kohe ka dëshmuar se nuk i shmanget drejtësisë dhe se ai vetë ka dhënë vullnetarisht dorëheqjen nga mandati deputetit”. Nga ana e saj Prokuroria kërkon arrestin me burg për zotin Tahiri. Gjatë seancës në Gjyatën e Shkallës së parë, prokurorët e çështjes deklaruan se kanë prova të reja që dëshmojnë për lidhjet e zotit Tahiri me vëllezërit Habilaj dhe grupin e tyre i cili u godit në Itali, tetorin e shkuar. Prokurorët thanë se disponojnë fakte se Tahiri ka qenë në shoqërinë e Habilajve e madje se është ndërhyrë dhe në sistemin TIMS, të policisë që rregjistron hyrje daljet nga vendi, për të fshirë lëvizjet e Moisi Habilajt, një prej të arrestuarve në Itali. Mbrëmë ambasadori amerikan Donald Lu deklaroi për portalin e informacionit “Balkanëeb” se “kemi dëgjuar disa raportime nga burime të pavarura për presione serioze në këtë çështje, përfshirë edhe rryshfete që u janë ofruar gjykatësve”. Ai i bëri “thirrje shoqërisë civile dhe medias që ta vëzhgojnë këtë çështje me vëmendje, në mënyrë që vendimi të bazohet mbi provat dhe ligjin dhe jo mbi presione, kërcënime apo para. Askush nuk është mbi ligjin”, theksoi ambasadori amerikan. Duke komentuar deklaratën e zoti Lu, avokati i zotit Tahiri tha sot se mesazhi i tij “ishte shumë i rëndësishëm që gjykata të gjykojë në prova dhe ligj, dhe nëse ndodh kështu Tahirit sot duhet t’i hiqet masa e arrestit në shtëpi”. Hetimet ndaj ish ministrit të Brendshëm, nisën tetorin e shkuar, nën dyshimet se kishte lidhje me grupin e vëllezërve Habilaj, kushërinj të tij, të cilët ishin pjesë e një organizate italo-shqiptare e cila trafikonte marijuanë nga Shqipëria drejt Italisë. Hetimet u hapën menjëherë pasi autoritetet italiane goditën këtë organizatë në Catania, ndërsa në përgjimet e kryera, emri i tij përmendet disa herë në bisedat mes trafikantëve. Prokuroria kërkoi me shpejtësi arrestimin e zotit Tahiri, por shumica e majtë, refuzoi kërkesën duke pretenduar se ajo nuk kishte paraqitur asnjë provë. Në fillim të muajit maj, zoti Tahiri dha dorëheqjen si deputet duke dorëzuar mandatin parlamentar, ndërsa deklaroi se dëshironte të hetohej e gjykohej si një qytetar i thjeshtë pa mburojë politike.","Ish ministri kundërshton “arrestin në shtëpi”. Prokuroria kërkon “arrest me burg”. Mbrëmë ambasadori amerikan Donald Lu foli për ""raportime nga burime të pavarura për presione serioze, përfshirë edhe rryshfete që u janë ofruar gjykatësve”."
"Sekretari amerikan i Shtetit Antony Blinken ripërsëriti paralajmërimin drejtuar Moskës se do të përballet me pasoja serioze nëse sulmon Ukrainën. Zoti Blinken i bëri komentet në Stokholm, gjatë një konference të përbashkët për shtyp me ministrin e Jashtëm rus Sergei Lavrov, para një takimi dypalëpsh me të. Dy diplomatët e lartë ndodhen në Stokholm në kuadër të takimit të ministrave të jashtëm vendeve anëtare të Organizatës për Siguri dhe Bashkëpunim në Evropë. Tensionet janë rritur në javët e fundit rreth dislokimit të trupave ruse pranë kufiri me Ukrainën. Kievi dhe Perëndimi, e shohin si një shenjë të mundshme të synimeve të Moskës për të pushtuar ish-fqinjin e saj sovjetik. Sekretari Blinken vuri theksin tek diplomacia si zgjidhje për situatën. ""”, tha zoti Blinken. Sekretari amerikan i Shtetit tha se Rusia dhe Ukraina duhet të zbatojnë plotësisht detyrimet e tyre sipas procesit të paqes të Minskut të vitit 2014, i krijuar për t'i dhënë fund luftës mes separatistëve pro-rusë dhe forcave të qeverisë ukrainase në lindje të Ukrainës. Ai premtoi ndihmën e Uashingtonit në këtë drejtim. Ministri i Jashtëm rus tha se Moska ishte e gatshme për dialog me Kievin. “”, tha ai. Ish-ambasadori i SHBA-së në Ukrainë Bill Taylor e përshëndeti takimin e sekretarit Blinken me ministrin Lavrov. Zoti Taylor tha për Zërin e Amerikës se zoti Blinken ka të ngjarë t’i japë një mesazh nga Presidenti Joe Biden për Presidentin rus Vladimir Putin. “”, tha ai. Sekretari Blinken zhvilloi një takim dy palësh edhe me ministrin e Jashtëm të Ukrainës Dmytro Kuleba. Të mërkurën, Presidenti Putin tha se dëshiron ""marrëveshje konkrete"" me zyrtarët amerikanë, që NATO nuk do të zgjerohet drejt lindjes. ""”, tha ai. Zoti Blinken ka deklaruar se komentet e zotit Putin se Rusia është ajo që po kërcënohet nga Ukraina dhe NATO, do të konsideroheshin si një shaka, nëse situata nuk do të ishte aq serioze. Ndërkohë, një mesazh për presidentin rus ka përcjellë edhe Sekretari i Përgjithshëm i NATO-s, Jens Stoltenberg. """". Ukraina është bërë pika kryesore e përplasjes mes Rusisë dhe Perëndimit. Kievi thotë se Rusia ka dislokuar më shumë se 90,000 trupa pranë kufijve të Ukrainës.",Tensionet janë rritur në javët e fundit rreth dislokimit të trupave ruse pranë kufirit me Ukrainën. 
